no,notes,Rufa_subpop,track_data,movebank_name,move_bank_no. ,Project,LotekSerialNum,Program_number,tag-manufacturer-name,tag-model,tag-mass,repetition_no,duty-cycle,tag-comment,ArgosID,attachment_type,deployment-comment,deploy-on-person,deploy-on-latitude,deploy-on-longitude,,Banding_or_recapture_Date,deploy-on-timestamp,Location,Band Number,animal-marker-id,animal-id,Code,AGE,SEX,deploy-on-measurements,WEIGHT,FIRE TIME,Lapsed minutes,deploy_d,deploy_m,deply_y
0,,,,,,to be split by study,tag-serial-no,Program_number,tag-manufacturer-name,tag-model,tag-mass,tag-beacon-frequency,duty-cycle,tag-comment,tag-id,attachment_type,deployment-comment,deploy-on-person,deploy-on-latitude,deploy-on-longitude,deployment-id,deploy-on-date,deploy-on-timestamp,study-site,animal-ring-id,animal-marker-id,animal-id,Code,animal-life-stage,animal-sex,deploy-on-measurements,animal-mass,capture-timestamp,capture-handling-time,,,
7,,,track,Red Knot Atlantic Shores,1235069252,Atlantic Shores,1591,7165,Lotek,Lotek PinPoint GPS-Argos 75,,,,,204351,,,,,,,22/8/2020,2020/08/22 16:30:00.00,NBRIG  ,1392-24666,,,FELG(Y*J)/-:-/m,ASY,u,,199,16:00,30,,,
2,,,track,Red Knot Atlantic Shores,1235069252,Atlantic Shores,1592,7165,Lotek,Lotek PinPoint GPS-Argos 75,,,,,204352,,,,,,,13/8/2020,2020/08/13 11:42:00.00,NBRIG  ,1392-24660,,,FELG(Y*T)/-:-/m,ASY,u,"'{culmenInMillimeters:36.1,theadInMilimeters:65.4, wingInMillimeters:166}'",211,11:25,17,,,
16,,,failed,Red Knot Atlantic Shores,1235069252,Atlantic Shores,1593,7165,Lotek,Lotek PinPoint GPS-Argos 75,,,,,204353,,,,,,,24/8/2020,2020/08/24 11:40:00.00,NBRIG  ,1392-24688,,,FELG(U*H)/-:-/m,ASY,u,,177,10:50,50,,,
26,,,failed,Red Knot Atlantic Shores,1235069252,Atlantic Shores,1594,7165,Lotek,Lotek PinPoint GPS-Argos 75,,,,,204354,,,,,,,24/8/2020,2020/08/24 11:58:00.00,NBRIG  ,1332-64665,,,FELG(T*P)/-:-/m,ASY,u,,161,10:50,68,,,
18,,,failed,Red Knot Atlantic Shores,1235069252,Atlantic Shores,1595,7165,Lotek,Lotek PinPoint GPS-Argos 75,,,,,204355,,,,,,,24/8/2020,2020/08/24 11:43:00.00,NBRIG  ,1392-24690,,,FELG(U*C)/-:-/m,ASY,u,,181,10:50,53,,,
21,,,failed,Red Knot Atlantic Shores,1235069252,Atlantic Shores,1596,7165,Lotek,Lotek PinPoint GPS-Argos 75,,,,,204356,,,,,,,24/8/2020,2020/08/24 11:47:00.00,NBRIG  ,1392-24693,,,FELG(T*X)/-:-/m,ASY,u,,158,10:50,57,,,
5,,,track,Red Knot Atlantic Shores,1235069252,Atlantic Shores,1597,7165,Lotek,Lotek PinPoint GPS-Argos 75,,,,,204357,,,,,,,13/8/2020,2020/08/13 12:01:00.00,NBRIG  ,1392-24664,,,FELG(Y*L)/-:-/m,ASY,u,"'{culmenInMillimeters:33.6,theadInMilimeters:64.1, wingInMillimeters:172}'",182,11:25,36,,,
25,,,failed,Red Knot Atlantic Shores,1235069252,Atlantic Shores,1598,7165,Lotek,Lotek PinPoint GPS-Argos 75,,,,,204358,,,,,,,24/8/2020,2020/08/24 12:01:00.00,NBRIG  ,1392-24698,,,FELG(T*M)/-:-/m,ASY,u,,159,10:50,71,,,
8,,,track,Red Knot Atlantic Shores,1235069252,Atlantic Shores,1599,7165,Lotek,Lotek PinPoint GPS-Argos 75,,,,,204359,,,,,,,22/8/2020,2020/08/22 16:34:00.00,NBRIG  ,1392-24667,,,FELG(Y*H)/-:-/m,ASY,u,,166,16:00,34,,,
15,,,failed,Red Knot Atlantic Shores,1235069252,Atlantic Shores,1600,7165,Lotek,Lotek PinPoint GPS-Argos 75,,,,,204360,,,,,,,24/8/2020,2020/08/24 11:34:00.00,NBRIG  ,1392-24686,,,FELG(U*N)/-:-/m,ASY,u,,159,10:50,44,,,
1,,,track,Red Knot Atlantic Shores,1235069252,Atlantic Shores,1601,7165,Lotek,Lotek PinPoint GPS-Argos 75,,,,,204361,,,,,,,13/8/2020,2020/08/13 11:40:00.00,NBRIG  ,1392-24659,,,FELG(Y*U)/-:-/m,ASY,u,"'{culmenInMillimeters:37.1,theadInMilimeters:67.2, wingInMillimeters:179}'",186,11:25,15,,,
3,,,track,Red Knot Atlantic Shores,1235069252,Atlantic Shores,1602,7165,Lotek,Lotek PinPoint GPS-Argos 75,,,,,204362,,,,,,,13/8/2020,2020/08/13 11:52:00.00,NBRIG  ,1392-24661,,,FELG(Y*P)/-:-/m,ASY,u,"'{culmenInMillimeters:34,theadInMilimeters:65.3, wingInMillimeters:168}'",184,11:25,27,,,
17,,,failed,Red Knot Atlantic Shores,1235069252,Atlantic Shores,1603,7165,Lotek,Lotek PinPoint GPS-Argos 75,,,,,204363,,,,,,,24/8/2020,2020/08/24 11:41:00.00,NBRIG  ,1392-24689,,,FELG(U*E)/-:-/m,ASY,u,,195,10:50,51,,,
6,,,track,Red Knot Atlantic Shores,1235069252,Atlantic Shores,1604,7165,Lotek,Lotek PinPoint GPS-Argos 75,,,,,204364,,,,,,,22/8/2020,2020/08/22 16:27:00.00,NBRIG  ,1392-24665,,,FELG(Y*K)/-:-/m,ASY,u,,164,16:00,27,,,
27,,,failed,Red Knot Atlantic Shores,1235069252,Atlantic Shores,1605,7165,Lotek,Lotek PinPoint GPS-Argos 75,,,,,204365,,,,,,,24/8/2020,2020/08/24 11:38:00.00,NBRIG  ,1332-98352,,,FELG(U*M)/-:-/m,ASY,u,,160,10:50,48,,,
14,,,failed,Red Knot Atlantic Shores,1235069252,Atlantic Shores,1606,7165,Lotek,Lotek PinPoint GPS-Argos 75,,,,,204366,,,,,,,24/8/2020,2020/08/24 11:32:00.00,NBRIG  ,1392-24684,,,FELG(U*T)/-:-/m,ASY,u,,171,10:50,42,,,
12,,,failed,Red Knot Atlantic Shores,1235069252,Atlantic Shores,1607,7165,Lotek,Lotek PinPoint GPS-Argos 75,,,,,204367,,,,,,,24/8/2020,2020/08/24 11:23:00.00,NBRIG  ,1392-24681,,,FELG(V*A)/-:-/m,ASY,u,,162,10:50,33,,,
28,,,failed,Red Knot Atlantic Shores,1235069252,Atlantic Shores,1608,7165,Lotek,Lotek PinPoint GPS-Argos 75,,,,,204368,,,,,,,24/8/2020,2020/08/24 11:25:00.00,NBRIG  ,1282-01809,,,FELG(U*Y)/-:-/m,ASY,u,,165,10:50,35,,,
9,,,track,Red Knot Atlantic Shores,1235069252,Atlantic Shores,1609,7165,Lotek,Lotek PinPoint GPS-Argos 75,,,,,204369,,,,,,,22/8/2020,2020/08/22 17:02:00.00,NBRIG  ,1392-24675,,,FELG(V*M)/-:-/m,ASY,u,,161,16:00,62,,,
4,,,track,Red Knot Atlantic Shores,1235069252,Atlantic Shores,1610,7165,Lotek,Lotek PinPoint GPS-Argos 75,,,,,204370,,,,,,,13/8/2020,2020/08/13 11:58:00.00,NBRIG  ,1392-24662,,,FELG(Y*N)/-:-/m,ASY,u,"'{culmenInMillimeters:37.1,theadInMilimeters:67.2, wingInMillimeters:174}'",190,11:25,33,,,
11,,,track,Red Knot Atlantic Shores,1235069252,Atlantic Shores,1611,7165,Lotek,Lotek PinPoint GPS-Argos 75,,,,,204371,,removed Nano 300 on deployment,,,,,22/8/2020,2020/08/22 16:35:00.00,NBRIG  ,1262-04794,,,FELG(695)/-:-/m,ASY,u,,179,16:00,35,,,
13,,,failed,Red Knot Atlantic Shores,1235069252,Atlantic Shores,1612,7165,Lotek,Lotek PinPoint GPS-Argos 75,,,,,204372,,,,,,,24/8/2020,2020/08/24 11:29:00.00,NBRIG  ,1392-24682,,,FELG(U*X)/-:-/m,ASY,u,,174,10:50,39,,,
20,,,failed,Red Knot Atlantic Shores,1235069252,Atlantic Shores,1613,7165,Lotek,Lotek PinPoint GPS-Argos 75,,,,,204373,,,,,,,24/8/2020,2020/08/24 11:46:00.00,NBRIG  ,1392-24692,,,FELG(T*Y)/-:-/m,ASY,u,,167,10:50,56,,,
19,,,failed,Red Knot Atlantic Shores,1235069252,Atlantic Shores,1614,7165,Lotek,Lotek PinPoint GPS-Argos 75,,,,,204374,,,,,,,24/8/2020,2020/08/24 11:44:00.00,NBRIG  ,1392-24691,,,FELG(U*A)/-:-/m,ASY,u,,171,10:50,54,,,
10,,,track,Red Knot Atlantic Shores,1235069252,Atlantic Shores,1615,7165,Lotek,Lotek PinPoint GPS-Argos 75,,,,,204375,,,,,,,22/8/2020,2020/08/22 17:07:00.00,NBRIG  ,1392-24678,,,FELG(V*E)/-:-/m,ASY,u,,175,16:00,67,,,
23,,,failed,Red Knot Atlantic Shores,1235069252,Atlantic Shores,1616,7165,Lotek,Lotek PinPoint GPS-Argos 75,,,,,204376,,,,,,,24/8/2020,2020/08/24 11:56:00.00,NBRIG  ,1392-24696,,,FELG(T*T)/-:-/m,ASY,u,,173,10:50,66,,,
22,,,failed,Red Knot Atlantic Shores,1235069252,Atlantic Shores,1617,7165,Lotek,Lotek PinPoint GPS-Argos 75,,,,,204377,,,,,,,24/8/2020,2020/08/24 11:49:00.00,NBRIG  ,1392-24694,,,FELG(T*V)/-:-/m,ASY,u,,171,10:50,59,,,
29,,,failed,Red Knot Atlantic Shores,1235069252,Atlantic Shores,1618,7165,Lotek,Lotek PinPoint GPS-Argos 75,,,,,204378,,,,,,,24/8/2020,2020/08/24 12:04:00.00,NBRIG  ,1392-24700,,,FELG(T*K)/-:-/m,ASY,u,,158,10:50,74,,,
24,,,failed,Red Knot Atlantic Shores,1235069252,Atlantic Shores,1619,7165,Lotek,Lotek PinPoint GPS-Argos 75,,,,,204379,,,,,,,24/8/2020,2020/08/24 11:59:00.00,NBRIG  ,1392-24697,,,FELG(T*N)/-:-/m,ASY,u,,171,10:50,69,,,
269,Missing REF ?Duplicate CWF study,,track,,,Atlantic Shores,54955,,Lotek,Lotek PinPoint GPS-Argos 75,,60,,,213827,,,,,,,26/5/2021,2021/05/26 13:24:00.00,Thomps,1392-24881,,,FELG(*EL)/-:-/m,ASY,u,"'{culmenInMillimeters:36.5,theadInMilimeters:65.3, wingInMillimeters:168}'",214,12:10,74,,,
270,Missing REF ?Duplicate CWF study,,track,,,Atlantic Shores,54956,,Lotek,Lotek PinPoint GPS-Argos 75,,60,,,213828,,,,,,,25/5/2021,2021/05/25 13:00:00.00,Norburyc,1392-24660,,,FELG(Y*T)/-:-/m,ASY,u,"'{culmenInMillimeters:36.8,theadInMilimeters:66.4, wingInMillimeters:173}'",186,12:25,35,,,
271,Missing REF ?Duplicate CWF study,,track,,,Atlantic Shores,54957,,Lotek,Lotek PinPoint GPS-Argos 75,,60,,,213829,,,,,,,19/5/2021,2021/05/19 14:47:00.00,Thomps,1172-72175,,,FELG(L2K)/-:-/m,ASY,u,"'{culmenInMillimeters:36.3,theadInMilimeters:65.6, wingInMillimeters:170}'",159,13:45,62,,,
272,Missing REF ?Duplicate CWF study,,track,,,Atlantic Shores,54958,,Lotek,Lotek PinPoint GPS-Argos 75,,60,,,213830,,,,,,,19/5/2021,2021/05/19 16:02:00.00,Thomps,1392-24347,,,FELG(*XC)/-:-/m,ASY,u,"'{culmenInMillimeters:35.8,theadInMilimeters:66.9, wingInMillimeters:169}'",151,13:45,137,,,
273,Missing REF ?Duplicate CWF study,,track,,,Atlantic Shores,54959,,Lotek,Lotek PinPoint GPS-Argos 75,,60,,,213831,,,,,,,25/5/2021,2021/05/25 13:00:00.00,Norburyc,1332-68607,,,FELG(LL=)/-:-/m,ASY,u,"'{culmenInMillimeters:37.7,theadInMilimeters:64.9, wingInMillimeters:175}'",195,12:25,35,,,
274,Missing REF ?Duplicate CWF study,,track,,,Atlantic Shores,54960,,Lotek,Lotek PinPoint GPS-Argos 75,,60,,,213832,,,,,,,19/5/2021,2021/05/19 14:51:00.00,Thomps,1392-24758,,,FELG(JH*)/-:-/m,ASY,u,"'{culmenInMillimeters:35.5,theadInMilimeters:67.8, wingInMillimeters:175}'",184,13:45,66,,,
275,Missing REF ?Duplicate CWF study,,track,,,Atlantic Shores,54945,,Lotek,Lotek PinPoint GPS-Argos 75,,60,,,213833,,,,,,,19/5/2021,2021/05/19 16:21:00.00,Thomps,1332-62758,,,FELG(46K)/-:-/m,ASY,u,"'{culmenInMillimeters:34.5,theadInMilimeters:64.5, wingInMillimeters:162}'",154,13:45,156,,,
276,Missing REF ?Duplicate CWF study,,track,,,Atlantic Shores,54946,,Lotek,Lotek PinPoint GPS-Argos 75,,60,,,213834,,,,,,,25/5/2021,2021/05/25 13:18:00.00,Norburyc,1392-24873,,,FELG(*LK)/-:-/m,ASY,u,"'{culmenInMillimeters:33.5,theadInMilimeters:64.6, wingInMillimeters:167}'",182,12:25,53,,,
277,Missing REF ?Duplicate CWF study,,track,,,Atlantic Shores,54947,,Lotek,Lotek PinPoint GPS-Argos 75,,60,,,213835,,,,,,,25/5/2021,2021/05/25 12:52:00.00,Norburyc,1172-71114,,,FELG(*LY)/-:-/m,ASY,u,"'{culmenInMillimeters:37.2,theadInMilimeters:67.7, wingInMillimeters:173}'",178,12:25,37,,,
278,Missing REF ?Duplicate CWF study,,track,,,Atlantic Shores,54948,,Lotek,Lotek PinPoint GPS-Argos 75,,60,,,213836,,,,,,,26/5/2021,2021/05/26 12:55:00.00,Thomps,1332-69677,,,FELG(=NY)/-:-/m,ASY,u,"'{culmenInMillimeters:34.2,theadInMilimeters:64.4, wingInMillimeters:171}'",180,12:10,45,,,
279,Missing REF ?Duplicate CWF study,,track,,,Atlantic Shores,54949,,Lotek,Lotek PinPoint GPS-Argos 75,,60,,,213837,,,,,,,19/5/2021,2021/05/19 14:32:00.00,Thomps,1322-18619,,,FELG(C18)/-:-/m,ASY,u,"'{culmenInMillimeters:35.6,theadInMilimeters:65.8, wingInMillimeters:170}'",104,13:45,47,,,
280,Missing REF ?Duplicate CWF study,,track,,,Atlantic Shores,54950,,Lotek,Lotek PinPoint GPS-Argos 75,,60,,,213838,,,,,,,19/5/2021,2021/05/19 14:47:00.00,Thomps,1332-28294,,,FELG(T99)/-:-/m,ASY,u,"'{culmenInMillimeters:34.6,theadInMilimeters:66.1, wingInMillimeters:171}'",163,13:45,62,,,
281,Missing REF ?Duplicate CWF study,,track,,,Atlantic Shores,54951,,Lotek,Lotek PinPoint GPS-Argos 75,,60,,,213839,,,,,,,19/5/2021,2021/05/19 14:47:00.00,Thomps,1392-24329,,,FELG(E3+)/-:-/m,ASY,u,"'{culmenInMillimeters:32.9,theadInMilimeters:62.6, wingInMillimeters:171}'",164,13:45,62,,,
282,Missing REF ?Duplicate CWF study,,track,,,Atlantic Shores,54952,,Lotek,Lotek PinPoint GPS-Argos 75,,60,,,213840,,,,,,,19/5/2021,2021/05/19 14:47:00.00,Thomps,1332-53906,,,FELG(H88)/-:-/m,ASY,u,"'{culmenInMillimeters:34.6,theadInMilimeters:63.2, wingInMillimeters:168}'",159,13:45,62,,,
283,Missing REF ?Duplicate CWF study,,track,,,Atlantic Shores,54953,,Lotek,Lotek PinPoint GPS-Argos 75,,60,,,213841,,,,,,,26/5/2021,2021/05/26 13:13:00.00,Thomps,1332-74716,,,FELG(>EU)/-:-/m,ASY,u,"'{culmenInMillimeters:37.5,theadInMilimeters:66.9, wingInMillimeters:179}'",181,12:10,63,,,
284,Missing REF ?Duplicate CWF study,,track,,,Atlantic Shores,54954,,Lotek,Lotek PinPoint GPS-Argos 75,,60,,,213842,,,,,,,19/5/2021,2021/05/19 14:47:00.00,Thomps,1332-54970,,,FELG(JA*)/-:-/m,ASY,u,"'{culmenInMillimeters:34.4,theadInMilimeters:64.8, wingInMillimeters:167}'",135,13:45,62,,,
36,,,track,Red Knot Atlantic Shores,1235069252,Atlantic Shores,55131,7165,Lotek,Lotek PinPoint GPS-Argos 75,,,,,224072,,,,,,,20/8/2021,2021/08/20 12:47:00.00,NBRIG,1392-24947,,,FELG(*TN)/-:-/m,ASY,u,"'{culmenInMillimeters:34.7,theadInMilimeters:64, wingInMillimeters:175}'",210,11:45,62,,,
55,,,track,Red Knot Atlantic Shores,1235069252,Atlantic Shores,55132,7165,Lotek,Lotek PinPoint GPS-Argos 75,,,,,224073,,,,,,,25/8/2021,2021/08/25 15:52:00.00,NBRIG,1392-24959,,,FELG(XJ>)/-:-/m,ASY,u,"'{culmenInMillimeters:35.7,theadInMilimeters:64, wingInMillimeters:172}'",192,15:00,52,,,
51,,,failed,Red Knot Atlantic Shores,1235069252,Atlantic Shores,55133,7165,Lotek,Lotek PinPoint GPS-Argos 75,,,,,224074,,,,,,,23/8/2021,2021/08/23 17:38:00.00,NBRIG,1392-24730,,,FELG(M*A)/-:-/m,ASY,u,"'{culmenInMillimeters:37.3,theadInMilimeters:66.2, wingInMillimeters:171}'",180,16:30,68,,,
57,,,track,Red Knot Atlantic Shores,1235069252,Atlantic Shores,55134,7165,Lotek,Lotek PinPoint GPS-Argos 75,,,,,224075,,,,,,,25/8/2021,2021/08/25 15:58:00.00,NBRIG,1392-24961,,,FELG(XL>)/-:-/m,ASY,u,"'{culmenInMillimeters:35.3,theadInMilimeters:62.6, wingInMillimeters:171}'",153,15:00,58,,,
53,,,track,Red Knot Atlantic Shores,1235069252,Atlantic Shores,55135,7165,Lotek,Lotek PinPoint GPS-Argos 75,,,,,224076,,,,,,,25/8/2021,2021/08/25 15:39:00.00,NBRIG,1392-24957,,,FELG(XE>)/-:-/m,ASY,u,"'{culmenInMillimeters:36.8,theadInMilimeters:64.7, wingInMillimeters:172}'",166,15:00,39,,,
31,,,track,Red Knot Atlantic Shores,1235069252,Atlantic Shores,55136,7165,Lotek,Lotek PinPoint GPS-Argos 75,,,,,224077,,,,,,,20/8/2021,2021/08/20 00:00:00.00,NBRIG,1392-24942,,,FELG(*TE)/-:-/m,ASY,u,"'{culmenInMillimeters:38.2,theadInMilimeters:64.8, wingInMillimeters:170}'",183,11:45,,,,
35,,,track,Red Knot Atlantic Shores,1235069252,Atlantic Shores,55137,7165,Lotek,Lotek PinPoint GPS-Argos 75,,,,,224078,,,,,,,20/8/2021,2021/08/20 12:41:00.00,NBRIG,1392-24946,,,FELG(*TM)/-:-/m,ASY,u,"'{culmenInMillimeters:35.1,theadInMilimeters:62.9, wingInMillimeters:163}'",170,11:45,56,,,
41,,,track,Red Knot Atlantic Shores,1235069252,Atlantic Shores,55138,7165,Lotek,Lotek PinPoint GPS-Argos 75,,,,,224079,,,,,,,20/8/2021,2021/08/20 13:05:00.00,NBRIG,1392-24952,,,FELG(*VA)/-:-/m,ASY,u,"'{culmenInMillimeters:34,theadInMilimeters:63.3, wingInMillimeters:171}'",180,11:45,80,,,
39,,,track,Red Knot Atlantic Shores,1235069252,Atlantic Shores,55139,7165,Lotek,Lotek PinPoint GPS-Argos 75,,,,,224080,,,,,,,20/8/2021,2021/08/20 12:59:00.00,NBRIG,1392-24950,,,FELG(*TV)/-:-/m,ASY,u,"'{culmenInMillimeters:35.8,theadInMilimeters:64.9, wingInMillimeters:171}'",189,11:45,74,,,
48,,,track,Red Knot Atlantic Shores,1235069252,Atlantic Shores,55140,7165,Lotek,Lotek PinPoint GPS-Argos 75,,,,,224081,,,,,,,23/8/2021,2021/08/23 17:53:00.00,NBRIG,1392-35724,,,FELG(*VX)/-:-/m,ASY,u,"'{culmenInMillimeters:34.2,theadInMilimeters:63.4, wingInMillimeters:172}'",161,16:30,83,,,
42,,,track,Red Knot Atlantic Shores,1235069252,Atlantic Shores,55141,7165,Lotek,Lotek PinPoint GPS-Argos 75,,,,,224082,,,,,,,20/8/2021,2021/08/20 13:09:00.00,NBRIG,1392-24953,,,FELG(*VE)/-:-/m,ASY,u,"'{culmenInMillimeters:38.5,theadInMilimeters:64.2, wingInMillimeters:173}'",163,11:45,84,,,
40,,,track,Red Knot Atlantic Shores,1235069252,Atlantic Shores,55142,7165,Lotek,Lotek PinPoint GPS-Argos 75,,,,,224083,,,,,,,20/8/2021,2021/08/20 13:03:00.00,NBRIG,1392-24951,,,FELG(*TX)/-:-/m,ASY,u,"'{culmenInMillimeters:36.7,theadInMilimeters:65.5, wingInMillimeters:169}'",191,11:45,78,,,
33,,,track,Red Knot Atlantic Shores,1235069252,Atlantic Shores,55144,7165,Lotek,Lotek PinPoint GPS-Argos 75,,,,,224085,,,,,,,20/8/2021,2021/08/20 12:33:00.00,NBRIG,1392-24944,,,FELG(*TK)/-:-/m,ASY,u,"'{culmenInMillimeters:34.3,theadInMilimeters:62.9, wingInMillimeters:169}'",174,11:45,48,,,
52,,,track,Red Knot Atlantic Shores,1235069252,Atlantic Shores,55145,7165,Lotek,Lotek PinPoint GPS-Argos 75,,,,,224086,,,,,,,25/8/2021,2021/08/25 00:00:00.00,NBRIG,1392-24956,,,FELG(XC>)/-:-/m,ASY,u,"'{culmenInMillimeters:33.5,theadInMilimeters:62.3, wingInMillimeters:168}'",177,15:00,,,,
49,,,track,Red Knot Atlantic Shores,1235069252,Atlantic Shores,55146,7165,Lotek,Lotek PinPoint GPS-Argos 75,,,,,224087,,,,,,,23/8/2021,2021/08/23 17:54:00.00,NBRIG,1392-35725,,,FELG(*VY)/-:-/m,ASY,u,"'{culmenInMillimeters:34,theadInMilimeters:65, wingInMillimeters:170}'",151,16:30,84,,,
60,,,track,Red Knot Atlantic Shores,1235069252,Atlantic Shores,55157,7165,Lotek,Lotek PinPoint GPS-Argos 75,,,,,224088,,,,,,,25/8/2021,2021/08/25 16:09:00.00,NBRIG,1392-24966,,,FELG(Y>9)/-:-/m,ASY,u,"'{culmenInMillimeters:35.5,theadInMilimeters:64.9, wingInMillimeters:171}'",152,15:00,69,,,
62,,,failed,Red Knot Fall Migration (Ocean Wind),2341148274,Ocean Wind,55074,,Lotek,Lotek PinPoint GPS-Argos 75,,60,,,221842,,,,,,,8/9/2021,2021/09/08 14:34:00.00,NBRIG,1392-24967,,,FELG(HA*)/-:-/m,ASY,u,"'{culmenInMillimeters:36.9,theadInMilimeters:66.2, wingInMillimeters:173}'",156,13:50,44,,,
63,,,failed,Red Knot Fall Migration (Ocean Wind),2341148274,Ocean Wind,55083,,Lotek,Lotek PinPoint GPS-Argos 75,,60,,,221851,,,,,,,8/9/2021,2021/09/08 14:34:00.00,NBRIG,1392-24968,,,FELG(HC*)/-:-/m,ASY,u,"'{culmenInMillimeters:34.4,theadInMilimeters:63.7, wingInMillimeters:171}'",160,13:50,44,,,
64,,,failed,Red Knot Fall Migration (Ocean Wind),2341148274,Ocean Wind,55080,,Lotek,Lotek PinPoint GPS-Argos 75,,60,,,221848,,,,,,,8/9/2021,2021/09/08 14:34:00.00,NBRIG,1392-24969,,,FELG(HE*)/-:-/m,SY,u,"'{culmenInMillimeters:34.2,theadInMilimeters:62.9, wingInMillimeters:174}'",150,13:50,44,,,
65,,,failed,Red Knot Fall Migration (Ocean Wind),2341148274,Ocean Wind,55070,,Lotek,Lotek PinPoint GPS-Argos 75,,60,,,221838,,,,,,,8/9/2021,2021/09/08 14:34:00.00,NBRIG,1392-24970,,,FELG(HH*)/-:-/m,ASY,u,"'{culmenInMillimeters:34.7,theadInMilimeters:65.1, wingInMillimeters:173}'",141,13:50,44,,,
66,,,failed,Red Knot Fall Migration (Ocean Wind),2341148274,Ocean Wind,55081,,Lotek,Lotek PinPoint GPS-Argos 75,,60,,,221849,,,,,,,8/9/2021,2021/09/08 14:34:00.00,NBRIG,1392-24971,,,FELG(HJ*)/-:-/m,ASY,u,"'{culmenInMillimeters:34.4,theadInMilimeters:62.8, wingInMillimeters:170}'",155,13:50,44,,,
67,,,failed,Red Knot Fall Migration (Ocean Wind),2341148274,Ocean Wind,55094,,Lotek,Lotek PinPoint GPS-Argos 75,,60,,,221862,,,,,,,20/10/2021,2021/10/20 15:17:00.00,AVALON,1392-24994,,,FELG(XU>)/-:-/m,ASY,u,"'{culmenInMillimeters:37.6,theadInMilimeters:67.5, wingInMillimeters:174}'",155,14:45,32,,,
68,,,failed,Red Knot Fall Migration (Ocean Wind),2341148274,Ocean Wind,55223,,Lotek,Lotek PinPoint GPS-Argos 75,,60,,,221837,,,,,,,20/10/2021,2021/10/20 00:00:00.00,AVALON,1392-24995,,,FELG(XV>)/-:-/m,ASY,u,"'{culmenInMillimeters:34.9,theadInMilimeters:64.4, wingInMillimeters:174}'",131,14:45,,,,
69,,,failed,Red Knot Fall Migration (Ocean Wind),2341148274,Ocean Wind,55096,,Lotek,Lotek PinPoint GPS-Argos 75,,60,,,221864,,,,,,,20/10/2021,2021/10/20 15:24:00.00,AVALON,1392-24996,,,FELG(XX>)/-:-/m,ASY,u,"'{culmenInMillimeters:36,theadInMilimeters:64.2, wingInMillimeters:166}'",125,14:45,39,,,
70,,,failed,Red Knot Fall Migration (Ocean Wind),2341148274,Ocean Wind,55093,,Lotek,Lotek PinPoint GPS-Argos 75,,60,,,221861,,,,,,,20/10/2021,2021/10/20 15:30:00.00,AVALON,1392-24997,,,FELG(XY>)/-:-/m,ASY,u,"'{culmenInMillimeters:38.2,theadInMilimeters:67.3, wingInMillimeters:}'",143,14:45,45,,,
71,,,failed,Red Knot Fall Migration (Ocean Wind),2341148274,Ocean Wind,55089,,Lotek,Lotek PinPoint GPS-Argos 75,,60,,,221857,,,,,,,20/10/2021,2021/10/20 15:34:00.00,AVALON,1392-24998,,,FELG(Y>0)/-:-/m,ASY,u,"'{culmenInMillimeters:34.6,theadInMilimeters:64.2, wingInMillimeters:168}'",139,14:45,49,,,
72,,,failed,Red Knot Fall Migration (Ocean Wind),2341148274,Ocean Wind,55087,,Lotek,Lotek PinPoint GPS-Argos 75,,60,,,221855,,,,,,,20/10/2021,2021/10/20 00:00:00.00,AVALON,1392-24999,,,FELG(Y>1)/-:-/m,ASY,u,"'{culmenInMillimeters:36.7,theadInMilimeters:64.7, wingInMillimeters:167}'",115,14:45,,,,
73,,,failed,Red Knot Fall Migration (Ocean Wind),2341148274,Ocean Wind,55085,,Lotek,Lotek PinPoint GPS-Argos 75,,60,,,221853,,,,,,,20/10/2021,2021/10/20 15:44:00.00,AVALON,1392-25000,,,FELG(Y>2)/-:-/m,ASY,u,"'{culmenInMillimeters:33.8,theadInMilimeters:63.4, wingInMillimeters:166}'",119,14:45,59,,,
74,,,failed,Red Knot Fall Migration (Ocean Wind),2341148274,Ocean Wind,55091,,Lotek,Lotek PinPoint GPS-Argos 75,,60,,,221859,,,,,,,20/10/2021,2021/10/20 15:58:00.00,AVALON,1392-35726,,,FELG(Y>4)/-:-/m,ASY,u,"'{culmenInMillimeters:35.2,theadInMilimeters:63.1, wingInMillimeters:}'",125,14:45,73,,,
75,,,failed,Red Knot Fall Migration (Ocean Wind),2341148274,Ocean Wind,55097,,Lotek,Lotek PinPoint GPS-Argos 75,,60,,,221865,,,,,,,20/10/2021,2021/10/20 16:01:00.00,AVALON,1392-35727,,,FELG(Y>5)/-:-/m,ASY,u,"'{culmenInMillimeters:37.5,theadInMilimeters:67.5, wingInMillimeters:}'",150,14:45,76,,,
76,,,failed,Red Knot Fall Migration (Ocean Wind),2341148274,Ocean Wind,55071,,Lotek,Lotek PinPoint GPS-Argos 75,,60,,,221839,,,,,,,20/10/2021,2021/10/20 15:53:00.00,AVALON,1332-55502,,,FELG(Y>3)/-:-/m,ASY,u,"'{culmenInMillimeters:33,theadInMilimeters:63.6, wingInMillimeters:}'",126,14:45,68,,,
77,,,failed,Red Knot Fall Migration (Ocean Wind),2341148274,Ocean Wind,55072,,Lotek,Lotek PinPoint GPS-Argos 75,,60,,,221840,,,,,,,27/10/2021,2021/10/27 00:00:00.00,AVALON,1392-35728,,,FELG(Y>6)/-:-/m,SY,u,"'{culmenInMillimeters:38.2,theadInMilimeters:64.2, wingInMillimeters:164}'",154,14:20,,,,
78,,,track,Red Knot Fall Migration (Ocean Wind),2341148274,Ocean Wind,55078,,Lotek,Lotek PinPoint GPS-Argos 75,,60,,,221846,,,,,,,27/10/2021,2021/10/27 14:25:00.00,AVALON,1392-35729,,,FELG(Y>7)/-:-/m,ASY,u,"'{culmenInMillimeters:39.6,theadInMilimeters:67.6, wingInMillimeters:163}'",157,14:20,5,,,
79,,,track,Red Knot Fall Migration (Ocean Wind),2341148274,Ocean Wind,55073,,Lotek,Lotek PinPoint GPS-Argos 75,,60,,,221841,,,,,,,27/10/2021,2021/10/27 14:32:00.00,AVALON,1392-35730,,,FELG(Y>8)/-:-/m,SY,u,"'{culmenInMillimeters:34.7,theadInMilimeters:64, wingInMillimeters:166}'",134,14:20,12,,,
80,,,track,Red Knot Fall Migration (Ocean Wind),2341148274,Ocean Wind,55084,,Lotek,Lotek PinPoint GPS-Argos 75,,60,,,221852,,,,,,,27/10/2021,2021/10/27 14:35:00.00,AVALON,1392-35731,,,FELG(*JU)/-:-/m,ASY,u,"'{culmenInMillimeters:33.5,theadInMilimeters:64.8, wingInMillimeters:166}'",134,14:20,15,,,
81,,,track,Red Knot Fall Migration (Ocean Wind),2341148274,Ocean Wind,55075,,Lotek,Lotek PinPoint GPS-Argos 75,,60,,,221843,,,,,,,27/10/2021,2021/10/27 14:38:00.00,AVALON,1392-35732,,,FELG(*JX)/-:-/m,SY,u,"'{culmenInMillimeters:35.8,theadInMilimeters:63.7, wingInMillimeters:}'",152,14:20,18,,,
82,,,failed,Red Knot Fall Migration (Ocean Wind),2341148274,Ocean Wind,55100,,Lotek,Lotek PinPoint GPS-Argos 75,,60,,,221868,,,,,,,27/10/2021,2021/10/27 14:42:00.00,AVALON,1392-35733,,,FELG(*JY)/-:-/m,SY,u,"'{culmenInMillimeters:34.3,theadInMilimeters:62.9, wingInMillimeters:166}'",131,14:20,22,,,
83,,,track,Red Knot Fall Migration (Ocean Wind),2341148274,Ocean Wind,55224,,Lotek,Lotek PinPoint GPS-Argos 75,,60,,,221867,,,,,,,27/10/2021,2021/10/27 15:12:00.00,AVALON,1392-35739,,,FELG(*KA)/-:-/m,SY,u,"'{culmenInMillimeters:29.2,theadInMilimeters:56, wingInMillimeters:160}'",120,14:20,52,,,
84,,,track,Red Knot Fall Migration (Ocean Wind),2341148274,Ocean Wind,55086,,Lotek,Lotek PinPoint GPS-Argos 75,,60,,,221854,,,,,,,10/11/2021,2021/11/10 09:36:00.00,STOHARB,1392-35741,,,FELG(*KE)/-:-/m,ASY,u,"'{culmenInMillimeters:37,theadInMilimeters:65.1, wingInMillimeters:170}'",143,9:00,36,,,
85,,,track,Red Knot Fall Migration (Ocean Wind),2341148274,Ocean Wind,55098,,Lotek,Lotek PinPoint GPS-Argos 75,,60,,,221866,,,,,,,10/11/2021,2021/11/10 00:00:00.00,STOHARB,1392-35742,,,FELG(*KH)/-:-/m,ASY,u,"'{culmenInMillimeters:36.7,theadInMilimeters:64.8, wingInMillimeters:171}'",149,9:00,,,,
86,,,track,Red Knot Fall Migration (Ocean Wind),2341148274,Ocean Wind,55077,,Lotek,Lotek PinPoint GPS-Argos 75,,60,,,221845,,,,,,,10/11/2021,2021/11/10 00:00:00.00,STOHARB,1392-35743,,,FELG(*KK)/-:-/m,ASY,u,"'{culmenInMillimeters:36.1,theadInMilimeters:66.4, wingInMillimeters:170}'",148,9:00,,,,
87,,,track,Red Knot Fall Migration (Ocean Wind),2341148274,Ocean Wind,55079,,Lotek,Lotek PinPoint GPS-Argos 75,,60,,,221847,,,,,,,10/11/2021,2021/11/10 00:00:00.00,STOHARB,1392-35744,,,FELG(*KM)/-:-/m,HY,u,"'{culmenInMillimeters:38,theadInMilimeters:65.9, wingInMillimeters:169}'",164,9:00,,,,
88,,,track,Red Knot Fall Migration (Ocean Wind),2341148274,Ocean Wind,55090,,Lotek,Lotek PinPoint GPS-Argos 75,,60,,,221858,,,,,,,10/11/2021,2021/11/10 00:00:00.00,STOHARB,1392-35745,,,FELG(*KN)/-:-/m,ASY,u,"'{culmenInMillimeters:37.9,theadInMilimeters:65.8, wingInMillimeters:168}'",159,9:00,,,,
89,,,track,Red Knot Fall Migration (Ocean Wind),2341148274,Ocean Wind,55076,,Lotek,Lotek PinPoint GPS-Argos 75,,60,,,221844,,,,,,,10/11/2021,2021/11/10 10:08:00.00,STOHARB,1392-35746,,,FELG(*HA)/-:-/m,ASY,u,"'{culmenInMillimeters:34.5,theadInMilimeters:62, wingInMillimeters:170}'",138,9:00,68,,,
90,,,track,Red Knot Fall Migration (Ocean Wind),2341148274,Ocean Wind,55088,,Lotek,Lotek PinPoint GPS-Argos 75,,60,,,221856,,,,,,,10/11/2021,2021/11/10 00:00:00.00,STOHARB,1392-35748,,,FELG(*HC)/-:-/m,ASY,u,"'{culmenInMillimeters:37.1,theadInMilimeters:66, wingInMillimeters:175}'",149,9:00,,,,
91,,,track,Red Knot Fall Migration (Ocean Wind),2341148274,Ocean Wind,55092,,Lotek,Lotek PinPoint GPS-Argos 75,,60,,,221860,,,,,,,10/11/2021,2021/11/10 00:00:00.00,STOHARB,1392-35750,,,FELG(*HJ)/-:-/m,HY,u,"'{culmenInMillimeters:36.8,theadInMilimeters:64.8, wingInMillimeters:171}'",159,9:00,,,,
92,,,track,Red Knot Fall Migration (Ocean Wind),2341148274,Ocean Wind,55095,,Lotek,Lotek PinPoint GPS-Argos 75,,60,,,221863,,,,,,,10/11/2021,2021/11/10 00:00:00.00,STOHARB,1332-69297,,,FELG(*KL)/m:-/-,ASY,u,"'{culmenInMillimeters:35,theadInMilimeters:63.7, wingInMillimeters:}'",156,9:00,,,,
93,,,track,Red Knot Fall Migration (Ocean Wind),2341148274,Ocean Wind,55082,,Lotek,Lotek PinPoint GPS-Argos 75,,60,,,221850,,,,,,,10/11/2021,2021/11/10 00:00:00.00,STOHARB,1332-69627,,,FELG(*KJ)/-:-/m,ASY,u,"'{culmenInMillimeters:33.8,theadInMilimeters:60.2, wingInMillimeters:}'",159,9:00,,,,
94,,,track,Red Knot Fall Migration (Ocean Wind),2341148274,Ocean Wind,55911,,Lotek,Lotek PinPoint GPS-Argos 75,,60,,,233928,,,,,,,18/8/2022,2022/08/18 10:45:00.00,NBRIG,1392-35500,,,FELG(1>A)/-:-/m,ASY,u,"'{culmenInMillimeters:38.2,theadInMilimeters:66.8, wingInMillimeters:165}'",198,10:15,30,,,
95,,,track,Red Knot Fall Migration (Ocean Wind),2341148274,Ocean Wind,55927,,Lotek,Lotek PinPoint GPS-Argos 75,,60,,,234181,,,,,,,18/8/2022,2022/08/18 10:49:00.00,NBRIG,1392-35499,,,FELG(5A>)/-:-/m,ASY,u,"'{culmenInMillimeters:37.6,theadInMilimeters:66.8, wingInMillimeters:167}'",157,10:15,34,,,
96,,,track,Red Knot Fall Migration (Ocean Wind),2341148274,Ocean Wind,55906,,Lotek,Lotek PinPoint GPS-Argos 75,,60,,,233923,,,,,,,18/8/2022,2022/08/18 10:53:00.00,NBRIG,1392-35154,,,FELG(5C>)/-:-/m,ASY,u,"'{culmenInMillimeters:35.4,theadInMilimeters:65.6, wingInMillimeters:170}'",149,10:15,38,,,
97,,,track,Red Knot Fall Migration (Ocean Wind),2341148274,Ocean Wind,55928,,Lotek,Lotek PinPoint GPS-Argos 75,,60,,,234182,,,,,,,18/8/2022,2022/08/18 10:57:00.00,NBRIG,1392-35155,,,FELG(5E>)/-:-/m,ASY,u,"'{culmenInMillimeters:35.4,theadInMilimeters:63.3, wingInMillimeters:167}'",155,10:15,42,,,
98,,,track,Red Knot Fall Migration (Ocean Wind),2341148274,Ocean Wind,55902,,Lotek,Lotek PinPoint GPS-Argos 75,,60,,,233919,,,,,,,18/8/2022,2022/08/18 11:17:00.00,NBRIG,1392-35159,,,FELG(5L>)/-:-/m,ASY,u,"'{culmenInMillimeters:39.3,theadInMilimeters:67.5, wingInMillimeters:168}'",149,10:15,62,,,
99,,,track,Red Knot Fall Migration (Ocean Wind),2341148274,Ocean Wind,55909,,Lotek,Lotek PinPoint GPS-Argos 75,,60,,,233926,,,,,,,18/8/2022,2022/08/18 11:21:00.00,NBRIG,1392-35160,,,FELG(5M>)/-:-/m,ASY,u,"'{culmenInMillimeters:36.1,theadInMilimeters:64.2, wingInMillimeters:167}'",187,10:15,66,,,
100,,,track,Red Knot Fall Migration (Ocean Wind),2341148274,Ocean Wind,55937,,Lotek,Lotek PinPoint GPS-Argos 75,,60,,,234191,,,,,,,18/8/2022,2022/08/18 11:25:00.00,NBRIG,1392-35161,,,FELG(5N>)/-:-/m,ASY,u,"'{culmenInMillimeters:36.8,theadInMilimeters:63.9, wingInMillimeters:155}'",135,10:15,70,,,
101,,,track,Red Knot Fall Migration (Ocean Wind),2341148274,Ocean Wind,55935,,Lotek,Lotek PinPoint GPS-Argos 75,,60,,,234189,,,,,,,18/8/2022,2022/08/18 10:50:00.00,NBRIG,1182-00644,,,-/m:FEW(LKY)/-,ASY,u,"'{culmenInMillimeters:35.6,theadInMilimeters:63.4, wingInMillimeters:164}'",152,10:15,35,,,
102,,,track,Red Knot Fall Migration (Ocean Wind),2341148274,Ocean Wind,55915,,Lotek,Lotek PinPoint GPS-Argos 75,,60,,,233932,,,,,,,1/9/2022,2022/09/01 10:12:00.00,TWOMILE,1392-35162,,,FELG(9A>)/-:-/m,ASY,u,"'{culmenInMillimeters:36.9,theadInMilimeters:67.2, wingInMillimeters:170}'",161,9:50,22,,,
103,,,track,Red Knot Fall Migration (Ocean Wind),2341148274,Ocean Wind,55904,,Lotek,Lotek PinPoint GPS-Argos 75,,60,,,233921,,,,,,,1/9/2022,2022/09/01 10:16:00.00,TWOMILE,1392-35163,,,FELG(9C>)/-:-/m,HY,u,"'{culmenInMillimeters:33.9,theadInMilimeters:65, wingInMillimeters:165}'",157,9:50,26,,,
104,,,track,Red Knot Fall Migration (Ocean Wind),2341148274,Ocean Wind,55931,,Lotek,Lotek PinPoint GPS-Argos 75,,60,,,234185,,,,,,,1/9/2022,2022/09/01 10:20:00.00,TWOMILE,1392-35164,,,FELG(9J>)/-:-/m,HY,u,"'{culmenInMillimeters:33.4,theadInMilimeters:63.9, wingInMillimeters:165}'",143,9:50,30,,,
105,,,track,Red Knot Fall Migration (Ocean Wind),2341148274,Ocean Wind,55913,,Lotek,Lotek PinPoint GPS-Argos 75,,60,,,233930,,,,,,,1/9/2022,2022/09/01 10:28:00.00,TWOMILE,1392-35166,,,FELG(9H>)/-:-/m,HY,u,"'{culmenInMillimeters:36.1,theadInMilimeters:65.7, wingInMillimeters:163}'",139,9:50,38,,,
106,,,track,Red Knot Fall Migration (Ocean Wind),2341148274,Ocean Wind,55910,,Lotek,Lotek PinPoint GPS-Argos 75,,60,,,233927,,,,,,,1/9/2022,2022/09/01 10:39:00.00,TWOMILE,1392-35169,,,FELG(>9A)/-:-/m,HY,u,"'{culmenInMillimeters:35.9,theadInMilimeters:65.6, wingInMillimeters:162}'",155,9:50,49,,,
107,,,failed,Red Knot Fall Migration (Ocean Wind),2341148274,Ocean Wind,55932,,Lotek,Lotek PinPoint GPS-Argos 75,,60,,,234186,,,,,,,28/9/2022,2022/09/28 12:25:00.00,STOHARB,1392-35391,,,FELG(OA>)/-:-/m,ASY,u,"'{culmenInMillimeters:35.3,theadInMilimeters:66.6, wingInMillimeters:}'",125,11:50,35,,,
108,,,track,Red Knot Fall Migration (Ocean Wind),2341148274,Ocean Wind,55933,,Lotek,Lotek PinPoint GPS-Argos 75,,60,,,234187,,,,,,,28/9/2022,2022/09/28 12:30:00.00,STOHARB,1392-35392,,,FELG(OC>)/-:-/m,ASY,u,"'{culmenInMillimeters:34.7,theadInMilimeters:67.7, wingInMillimeters:161}'",121,11:50,40,,,
109,,,track,Red Knot Fall Migration (Ocean Wind),2341148274,Ocean Wind,55903,,Lotek,Lotek PinPoint GPS-Argos 75,,60,,,233920,,,,,,,28/9/2022,2022/09/28 12:35:00.00,STOHARB,1392-35393,,,FELG(OE>)/-:-/m,ASY,u,"'{culmenInMillimeters:35.3,theadInMilimeters:66.8, wingInMillimeters:168}'",121,11:50,45,,,
110,,,track,Red Knot Fall Migration (Ocean Wind),2341148274,Ocean Wind,55936,,Lotek,Lotek PinPoint GPS-Argos 75,,60,,,234190,,,,,,,28/9/2022,2022/09/28 12:40:00.00,STOHARB,1392-35394,,,FELG(OH>)/-:-/m,ASY,u,"'{culmenInMillimeters:35.3,theadInMilimeters:66.9, wingInMillimeters:173}'",124,11:50,50,,,
111,,,track,Red Knot Fall Migration (Ocean Wind),2341148274,Ocean Wind,55905,,Lotek,Lotek PinPoint GPS-Argos 75,,60,,,233922,,,,,,,28/9/2022,2022/09/28 12:48:00.00,STOHARB,1392-35397,,,FELG(OK>)/-:-/m,ASY,u,"'{culmenInMillimeters:34.7,theadInMilimeters:65.7, wingInMillimeters:165}'",123,11:50,58,,,
112,,,track,Red Knot Fall Migration (Ocean Wind),2341148274,Ocean Wind,55907,,Lotek,Lotek PinPoint GPS-Argos 75,,60,,,233924,,,,,,,28/9/2022,2022/09/28 12:52:00.00,STOHARB,1392-35398,,,FELG(OL>)/-:-/m,ASY,u,"'{culmenInMillimeters:33.1,theadInMilimeters:66.2, wingInMillimeters:179}'",126,11:50,62,,,
113,,,track,Red Knot Fall Migration (Ocean Wind),2341148274,Ocean Wind,55930,,Lotek,Lotek PinPoint GPS-Argos 75,,60,,,234184,,,,,,,28/9/2022,2022/09/28 12:55:00.00,STOHARB,1392-35399,,,FELG(OM>)/-:-/m,ASY,u,"'{culmenInMillimeters:31.7,theadInMilimeters:64.1, wingInMillimeters:166}'",124,11:50,65,,,
114,,,track,Red Knot Fall Migration (Ocean Wind),2341148274,Ocean Wind,55908,,Lotek,Lotek PinPoint GPS-Argos 75,,60,,,233925,,,,,,,28/9/2022,2022/09/28 13:00:00.00,STOHARB,1392-35400,,,FELG(ON>)/-:-/m,ASY,u,"'{culmenInMillimeters:34.4,theadInMilimeters:66.8, wingInMillimeters:146}'",125,11:50,70,,,
115,,,track,Red Knot Fall Migration (Ocean Wind),2341148274,Ocean Wind,55924,,Lotek,Lotek PinPoint GPS-Argos 75,,60,,,234178,,,,,,,28/9/2022,2022/09/28 13:05:00.00,STOHARB,1392-35171,,,FELG(OP>)/-:-/m,ASY,u,"'{culmenInMillimeters:38.6,theadInMilimeters:65.9, wingInMillimeters:173}'",122,11:50,75,,,
116,,,track,Red Knot Fall Migration (Ocean Wind),2341148274,Ocean Wind,55925,,Lotek,Lotek PinPoint GPS-Argos 75,,60,,,234179,,,,,,,28/9/2022,2022/09/28 14:03:00.00,STOHARB,1392-35176,,,FELG(OY>)/-:-/m,ASY,u,"'{culmenInMillimeters:34.1,theadInMilimeters:63.2, wingInMillimeters:169}'",120,11:50,133,,,
117,,,track,Red Knot Fall Migration (Ocean Wind),2341148274,Ocean Wind,55929,,Lotek,Lotek PinPoint GPS-Argos 75,,60,,,234183,,,,,,,28/9/2022,2022/09/28 14:10:00.00,STOHARB,1392-35177,,,FELG(1Y>)/-:-/m,ASY,u,"'{culmenInMillimeters:36.9,theadInMilimeters:66.9, wingInMillimeters:168}'",127,11:50,140,,,
118,,,track,Red Knot Fall Migration (Ocean Wind),2341148274,Ocean Wind,55912,,Lotek,Lotek PinPoint GPS-Argos 75,,60,,,233929,,,,,,,28/9/2022,2022/09/28 14:15:00.00,STOHARB,1392-35178,,,FELG(1X>)/-:-/m,ASY,u,"'{culmenInMillimeters:36.6,theadInMilimeters:68.7, wingInMillimeters:172}'",126,11:50,145,,,
119,,,track,Red Knot Fall Migration (Ocean Wind),2341148274,Ocean Wind,55914,,Lotek,Lotek PinPoint GPS-Argos 75,,60,,,233931,,,,,,,28/9/2022,2022/09/28 14:20:00.00,STOHARB,1392-35179,,,FELG(1V>)/-:-/m,ASY,u,"'{culmenInMillimeters:39.6,theadInMilimeters:68.5, wingInMillimeters:170}'",120,11:50,150,,,
120,,,track,Red Knot Fall Migration (Ocean Wind),2341148274,Ocean Wind,55926,,Lotek,Lotek PinPoint GPS-Argos 75,,60,,,234180,,,,,,,28/9/2022,2022/09/28 14:25:00.00,STOHARB,1392-35180,,,FELG(1T>)/-:-/m,ASY,u,"'{culmenInMillimeters:35.1,theadInMilimeters:65.1, wingInMillimeters:168}'",116,11:50,155,,,
121,,,track,Red Knot Fall Migration (Ocean Wind),2341148274,Ocean Wind,55901,,Lotek,Lotek PinPoint GPS-Argos 75,,60,,,233918,,,,,,,28/9/2022,2022/09/28 13:30:00.00,STOHARB,1172-81920,,,FELG(1U>)/-:-/m,ASY,u,"'{culmenInMillimeters:33.2,theadInMilimeters:63.7, wingInMillimeters:162}'",116,11:50,100,,,
122,,,track,Red Knot Fall Migration (Ocean Wind),2341148274,Ocean Wind,55923,,Lotek,Lotek PinPoint GPS-Argos 75,,60,,,234177,,,,,,,28/9/2022,2022/09/28 13:40:00.00,STOHARB,1262-04504,,,-/m:FEDG(PPM)/-,ASY,u,"'{culmenInMillimeters:38.3,theadInMilimeters:67.1, wingInMillimeters:168}'",130,11:50,110,,,
123,,,track,Red Knot Spring Migration Study,1540391044,USFWS /spring migration,54960,,Lotek,Lotek PinPoint GPS-Argos 75,,60,,,213832,,,,,,,19/5/2021,2021/05/19 14:51:00.00,Thomps,1392-24758,,,FELG(JH*)/-:-/m,ASY,u,"'{culmenInMillimeters:35.5,theadInMilimeters:67.8, wingInMillimeters:175}'",184,13:45,66,,,
124,,,track,Red Knot Spring Migration Study,1540391044,USFWS /spring migration,54957,,Lotek,Lotek PinPoint GPS-Argos 75,,60,,,213829,,,,,,,19/5/2021,2021/05/19 14:47:00.00,Thomps,1172-72175,,,FELG(L2K)/-:-/m,ASY,u,"'{culmenInMillimeters:36.3,theadInMilimeters:65.6, wingInMillimeters:170}'",159,13:45,62,,,
125,,,track,Red Knot Spring Migration Study,1540391044,USFWS /spring migration,54952,,Lotek,Lotek PinPoint GPS-Argos 75,,60,,,213840,,,,,,,19/5/2021,2021/05/19 14:47:00.00,Thomps,1332-53905,,,FELG(H88)/-:-/m,ASY,u,"'{culmenInMillimeters:34.6,theadInMilimeters:63.2, wingInMillimeters:168}'",159,13:45,62,,,
126,,,track,Red Knot Spring Migration Study,1540391044,USFWS /spring migration,54950,,Lotek,Lotek PinPoint GPS-Argos 75,,60,,,213838,,,,,,,19/5/2021,2021/05/19 14:47:00.00,Thomps,1332-28293,,,FELG(T99)/-:-/m,ASY,u,"'{culmenInMillimeters:34.6,theadInMilimeters:66.1, wingInMillimeters:171}'",163,13:45,62,,,
127,,,track,Red Knot Spring Migration Study,1540391044,USFWS /spring migration,54951,,Lotek,Lotek PinPoint GPS-Argos 75,,60,,Recorded incorrectly on field sheet as 1392-24128,213839,,,,,,,19/5/2021,2021/05/19 14:47:00.00,Thomps,1392-24328,,,FELG(E3+)/-:-/m,ASY,u,"'{culmenInMillimeters:32.9,theadInMilimeters:62.6, wingInMillimeters:171}'",164,13:45,62,,,
128,,,track,Red Knot Spring Migration Study,1540391044,USFWS /spring migration,54954,,Lotek,Lotek PinPoint GPS-Argos 75,,60,,,213842,,,,,,,19/5/2021,2021/05/19 14:47:00.00,Thomps,1332-54969,,,FELG(JA*)/-:-/m,ASY,u,"'{culmenInMillimeters:34.4,theadInMilimeters:64.8, wingInMillimeters:167}'",135,13:45,62,,,
129,,,no track (see atlantic shores),Red Knot Spring Migration Study,1540391044,USFWS /spring migration,54949,,Lotek,Lotek PinPoint GPS-Argos 75,,60,,,213837,,,,,,,19/5/2021,2021/05/19 14:32:00.00,Thomps,1322-18618,,,FELG(C18)/-:-/m,ASY,u,"'{culmenInMillimeters:35.6,theadInMilimeters:65.8, wingInMillimeters:170}'",104,13:45,47,,,
130,,,track,Red Knot Spring Migration Study,1540391044,USFWS /spring migration,54945,,Lotek,Lotek PinPoint GPS-Argos 75,,60,,,213833,,,,,,,19/5/2021,2021/05/19 16:21:00.00,Thomps,1332-62758,,,FELG(46K)/-:-/m,ASY,u,"'{culmenInMillimeters:34.5,theadInMilimeters:64.5, wingInMillimeters:162}'",154,13:45,156,,,
131,,,track,Red Knot Spring Migration Study,1540391044,USFWS /spring migration,54958,,Lotek,Lotek PinPoint GPS-Argos 75,,60,,,213830,,,,,,,19/5/2021,2021/05/19 16:02:00.00,Thomps,1392-24347,,,FELG(*XC)/-:-/m,ASY,u,"'{culmenInMillimeters:35.8,theadInMilimeters:66.9, wingInMillimeters:169}'",151,13:45,137,,,
132,,,track,Red Knot Spring Migration Study,1540391044,USFWS /spring migration,54946,,Lotek,Lotek PinPoint GPS-Argos 75,,60,,,213834,,,,,,,25/5/2021,2021/05/25 13:18:00.00,Norburyc,1392-24873,,,FELG(*LK)/-:-/m,ASY,u,"'{culmenInMillimeters:33.5,theadInMilimeters:64.6, wingInMillimeters:167}'",182,12:25,53,,,
133,,,track,Red Knot Spring Migration Study,1540391044,USFWS /spring migration,54956,,Lotek,Lotek PinPoint GPS-Argos 75,,60,,,213828,,,,,,,25/5/2021,2021/05/25 13:00:00.00,Norburyc,1392-24660,,,FELG(Y*T)/-:-/m,ASY,u,"'{culmenInMillimeters:36.8,theadInMilimeters:66.4, wingInMillimeters:173}'",186,12:25,35,,,
134,,,track,Red Knot Spring Migration Study,1540391044,USFWS /spring migration,54959,,Lotek,Lotek PinPoint GPS-Argos 75,,60,,,213831,,,,,,,25/5/2021,2021/05/25 13:00:00.00,Norburyc,1332-68607,,,FELG(LL=)/-:-/m,ASY,u,"'{culmenInMillimeters:37.7,theadInMilimeters:64.9, wingInMillimeters:175}'",195,12:25,35,,,
135,,,track,Red Knot Spring Migration Study,1540391044,USFWS /spring migration,54947,,Lotek,Lotek PinPoint GPS-Argos 75,,60,,,213835,,,,,,,25/5/2021,2021/05/25 12:52:00.00,Norburyc,1172-71114,,,FELG(*LY)/-:-/m,ASY,u,"'{culmenInMillimeters:37.2,theadInMilimeters:67.7, wingInMillimeters:173}'",178,12:25,37,,,
136,,,track,Red Knot Spring Migration Study,1540391044,USFWS /spring migration,54955,,Lotek,Lotek PinPoint GPS-Argos 75,,60,,,213827,,,,,,,26/5/2021,2021/05/26 13:24:00.00,Thomps,1392-24881,,,FELG(*EL)/-:-/m,ASY,u,"'{culmenInMillimeters:36.5,theadInMilimeters:65.3, wingInMillimeters:168}'",214,12:10,74,,,
137,,,track,Red Knot Spring Migration Study,1540391044,USFWS /spring migration,54953,,Lotek,Lotek PinPoint GPS-Argos 75,,60,,,213841,,,,,,,26/5/2021,2021/05/26 13:13:00.00,Thomps,1332-74715,,,FELG(>EU)/-:-/m,ASY,u,"'{culmenInMillimeters:37.5,theadInMilimeters:66.9, wingInMillimeters:179}'",181,12:10,63,,,
138,,,track,Red Knot Spring Migration Study,1540391044,USFWS /spring migration,54948,,Lotek,Lotek PinPoint GPS-Argos 75,,60,,,213836,,,,,,,26/5/2021,2021/05/26 12:55:00.00,Thomps,1332-69677,,,FELG(=NY)/-:-/m,ASY,u,"'{culmenInMillimeters:34.2,theadInMilimeters:64.4, wingInMillimeters:171}'",180,12:10,45,,,
162,,uk,track,Red Knot Migration Study ECCC,2272951887,ECCC,55678,,Lotek,gps-pinpoint,,60,,,230299,,,,,,,25/5/2022,2022/05/25 13:02:00.00,FORTESCU,1332-69167,FELG(L8*),FORT_230299_2022,FELG(L8*)/-:-/m,ASY,u,"'{culmenInMillimeters:38.2,theadInMilimeters:65.9, wingInMillimeters:170}'",173,11:33,89,,,
145,,uk,track,Red Knot Migration Study ECCC,2272951887,ECCC,55679,,Lotek,gps-pinpoint,,60,,,230300,,,,,,,16/5/2022,2022/05/16 13:12:00.00,KIMBLESO,1392-24739,FELG(M*U),KIMB_230300_2022,FELG(M*U)/-:-/m,ASY,u,"'{culmenInMillimeters:33.1,theadInMilimeters:65.7, wingInMillimeters:170}'",136,12:30,42,,,
148,,uk,track,Red Knot Migration Study ECCC,2272951887,ECCC,55680,,Lotek,gps-pinpoint,,60,,,230301,,,,,,,21/5/2022,2022/05/21 11:38:00.00,MOORES,1392-35236,FELG(5>K),MOOR_230301_2022,FELG(5>K)/-:-/m,ASY,u,,141,10:35,63,,,
149,,uk,track,Red Knot Migration Study ECCC,2272951887,ECCC,55681,,Lotek,gps-pinpoint,,60,,,230302,,,,,,,21/5/2022,2022/05/21 11:09:00.00,MOORES,1332-98993,FELG(0+V),MOOR_230302_2022,FELG(0+V)/-:-/m,ASY,u,,177,10:35,34,,,
155,,uk,track,Red Knot Migration Study ECCC,2272951887,ECCC,55682,,Lotek,gps-pinpoint,,60,,,230303,,,,,,,21/5/2022,2022/05/21 00:00:00.00,MOORES,1332-74312,FELG(=9U),MOOR_230303_2022,FELG(=9U)/-:-/m,ASY,u,,,10:35,,,,
153,,uk,track,Red Knot Migration Study ECCC,2272951887,ECCC,55683,,Lotek,gps-pinpoint,,60,,,230304,,,,,,,21/5/2022,2022/05/21 12:06:00.00,MOORES,1392-35252,FELG(6>M),MOOR_230304_2022,FELG(6>M)/-:-/m,ASY,u,"'{culmenInMillimeters:35,theadInMilimeters:65.8, wingInMillimeters:166}'",147,10:35,91,,,
140,,uk,track,Red Knot Migration Study ECCC,2272951887,ECCC,55684,,Lotek,gps-pinpoint,,60,,,230305,,,,,,,16/5/2022,2022/05/16 13:25:00.00,KIMBLESO,1392-35784,FELG(*NT),KIMB_230305_2022,FELG(*NT)/-:-/m,ASY,u,"'{culmenInMillimeters:38,theadInMilimeters:67, wingInMillimeters:174}'",161,12:30,55,,,
161,,uk,track,Red Knot Migration Study ECCC,2272951887,ECCC,55685,,Lotek,gps-pinpoint,,60,,,230306,,,,,,,25/5/2022,2022/05/25 13:09:00.00,FORTESCU,1392-35423,FELG(T8*),FORT_230306_2022,FELG(T8*)/-:-/m,SY,u,"'{culmenInMillimeters:34.7,theadInMilimeters:63.2, wingInMillimeters:164}'",132,11:33,96,,,
165,,uk,track,Red Knot Migration Study ECCC,2272951887,ECCC,55686,,Lotek,gps-pinpoint,,60,,,230307,,,,,,,25/5/2022,2022/05/25 12:59:00.00,FORTESCU,1332-73082,FELG(+94),FORT_230307_2022,FELG(+94)/-:-/m,ASY,u,"'{culmenInMillimeters:37.6,theadInMilimeters:67.6, wingInMillimeters:168}'",175,11:33,86,,,
160,,uk,track,Red Knot Migration Study ECCC,2272951887,ECCC,55687,,Lotek,gps-pinpoint,,60,,,230308,,,,,,,25/5/2022,2022/05/25 12:02:00.00,FORTESCU,1332-69665,FELG(=TE),FORT_230308_2022,FELG(=TE)/-:-/m,ASY,u,"'{culmenInMillimeters:37.2,theadInMilimeters:66.9, wingInMillimeters:171}'",178,11:33,29,,,
147,,uk,track,Red Knot Migration Study ECCC,2272951887,ECCC,55688,,Lotek,gps-pinpoint,,60,,,230309,,,,,,,21/5/2022,2022/05/21 11:22:00.00,MOORES,1392-35223,FELG(4>M),MOOR_230309_2022,FELG(4>M)/-:-/m,ASY,u,"'{culmenInMillimeters:35.6,theadInMilimeters:66.4, wingInMillimeters:168}'",137,10:35,47,,,
157,,uk,track,Red Knot Migration Study ECCC,2272951887,ECCC,55689,,Lotek,gps-pinpoint,,60,,,230310,,,,,,,25/5/2022,2022/05/25 12:32:00.00,FORTESCU,1332-73220,FELG(=93),FORT_230310_2022,FELG(=93)/-:-/m,ASY,u,"'{culmenInMillimeters:37.7,theadInMilimeters:67.5, wingInMillimeters:173}'",205,11:33,59,,,
163,,uk,track,Red Knot Migration Study ECCC,2272951887,ECCC,55690,,Lotek,gps-pinpoint,,60,,,230311,,,,,,,25/5/2022,2022/05/25 12:59:00.00,FORTESCU,1392-35224,FELG(4>N),FORT_230311_2022,FELG(4>N)/-:-/m,ASY,u,"'{culmenInMillimeters:31.3,theadInMilimeters:60.8, wingInMillimeters:170}'",163,11:33,86,,,
164,,uk,track,Red Knot Migration Study ECCC,2272951887,ECCC,55691,,Lotek,gps-pinpoint,,60,,,230312,,,,,,,25/5/2022,2022/05/25 12:48:00.00,FORTESCU,1332-98175,FELG(M2*),FORT_230312_2022,FELG(M2*)/-:-/m,ASY,u,"'{culmenInMillimeters:37.9,theadInMilimeters:67, wingInMillimeters:179}'",169,11:33,75,,,
142,all errors - corrupt tag?,,failed,Red Knot Migration Study ECCC,2272951887,ECCC,55692,,Lotek,gps-pinpoint,,60,,,230313,,,,,,,16/5/2022,2022/05/16 13:10:00.00,KIMBLESO,1282-02747,FELG(*NM),KIMB_230313_2022,FELG(*NM)/-:-/m,ASY,u,"'{culmenInMillimeters:35.1,theadInMilimeters:64.4, wingInMillimeters:169}'",110,12:30,40,,,
158,,uk,track,Red Knot Migration Study ECCC,2272951887,ECCC,55693,,Lotek,gps-pinpoint,,60,,,230314,,,,,,,25/5/2022,2022/05/25 12:20:00.00,FORTESCU,1332-55516,FELG(M6*),FORT_230314_2022,FELG(M6*)/-:-/m,ASY,u,"'{culmenInMillimeters:38.6,theadInMilimeters:66.1, wingInMillimeters:172}'",188,11:33,47,,,
154,,uk,track,Red Knot Migration Study ECCC,2272951887,ECCC,55694,,Lotek,gps-pinpoint,,60,,,230315,,,,,,,21/5/2022,2022/05/21 11:51:00.00,MOORES,H75098,FEDB(H0Y),MOOR_230315_2022,FEDB(H0Y)/-:m/-,ASY,u,"'{culmenInMillimeters:39.9,theadInMilimeters:68, wingInMillimeters:134}'",146,10:35,76,,,
141,,uk,track,Red Knot Migration Study ECCC,2272951887,ECCC,55695,,Lotek,gps-pinpoint,,60,,,230316,,,,,,,16/5/2022,2022/05/16 13:16:00.00,KIMBLESO,9822-53152,FEW(LTP),KIMB_230316_2022,-/m:FEW(LTP)/-,ASY,u,"'{culmenInMillimeters:37.2,theadInMilimeters:63.2, wingInMillimeters:167}'",132,12:30,46,,,
159,,uk,track,Red Knot Migration Study ECCC,2272951887,ECCC,55696,,Lotek,gps-pinpoint,,60,,,230317,,"The band no. of this re-trap was read three times in two independent teams. While in the DE records as originally 1332-62185, it is believed DE has made a FS or data entry error. There was a similar situation in 2019 that documents that 62158-186 was entered for 358-386. This retrap is further proof of the error.",,,,,25/5/2022,2022/05/25 12:08:00.00,FORTESCU,1332-62385,FELG(1X6),FORT_230317_2022,FELG(1X6)/-:-/m,ASY,u,"'{culmenInMillimeters:35.8,theadInMilimeters:64.6, wingInMillimeters:176}'",188,11:33,35,,,
146,,uk,track,Red Knot Migration Study ECCC,2272951887,ECCC,55697,,Lotek,gps-pinpoint,,60,,,230318,,,,,,,16/5/2022,2022-05-16 12:30:00.000,KIMBLESO,1332-98518,FELG(+4Y),KIMB_230318_2022,FELG(+4Y)/-:-/m,ASY,u,"'{culmenInMillimeters:34.5,theadInMilimeters:64.4, wingInMillimeters:170}'",121,12:30:00 pm,,,,
151,,uk,track,Red Knot Migration Study ECCC,2272951887,ECCC,55698,,Lotek,gps-pinpoint,,60,,,230319,,,,,,,21/5/2022,2022/05/21 11:03:00,MOORES,1322-36410,FELG(A=V),MOOR_230319_2022,FELG(A=V)/-:-/m,ASY,u,,170,10:35:00 am,28,,,
156,,uk,track,Red Knot Migration Study ECCC,2272951887,ECCC,55699,,Lotek,gps-pinpoint,,60,,,230320,,,,,,,21/5/2022,2022/05/21 11:01:00,MOORES,1392-35847,FELG(>YA),MOOR_230320_2022,FELG(>YA)/-:-/m,ASY,u,,185,10:35:00 am,26,,,
150,,uk,track,Red Knot Migration Study ECCC,2272951887,ECCC,40518,,Lotek,sunbird,,,,,232980,,,,,,,21/5/2022,2022/05/21 11:05:00.00,MOORES,1332-74332,FELG(4>E),MOOR_232980_2022,FELG(4>E)/-:-/m,ASY,u,,166,10:35,30,,,
152,,,track,Red Knot Migration Study ECCC,2272951887,ECCC,40519,,Lotek,sunbird,,,,,232981,,,,,,,21/5/2022,2022/05/21 11:00:00.00,MOORES,0802-64979,FEW(CMM),MOOR_232981_2022,-/m:FEW(CMM)/-,ASY,u,,144,10:35,25,,,
174,,uk,track,Red Knot Migration Study ECCC,2272951887,ECCC,41840,21765,Lotek,sunbird,,,,,232982,,Green braided polyester,,,,,16/5/2023,2023/05/16 11:14:00.00,MOORES,1332-28220,FELG(Y37),MOOR_232982_2023,FELG(Y37)/-:-/m,ASY,u,"'{culmenInMillimeters:39.9,theadInMilimeters:69.8, wingInMillimeters:180}'",151,11:14,53,,,
139,,,track,Red Knot Migration Study ECCC,2272951887,ECCC,40481,,Lotek,sunbird,,,,,232984,,,,,,,16/5/2022,2022/05/16 12:52:00.00,KIMBLESO,1392-35783,FELG(*NP),KIMB_232984_2022,FELG(*NP)/-:-/m,ASY,u,"'{culmenInMillimeters:33.8,theadInMilimeters:67.3, wingInMillimeters:171}'",121,12:30,22,,,
143,,uk,track,Red Knot Migration Study ECCC,2272951887,ECCC,40482,,Lotek,sunbird,,,,,232985,,,,,,,16/5/2022,2022/05/16 12:58:00.00,KIMBLESO,1332-79086,FELG(C95),KIMB_232985_2022,FELG(C95)/-:-/m,ASY,u,"'{culmenInMillimeters:38.8,theadInMilimeters:68.4, wingInMillimeters:181}'",151,12:30,28,,,
144,,uk,track,Red Knot Migration Study ECCC,2272951887,ECCC,40517,,Lotek,sunbird,,,,,232986,,,,,,,16/5/2022,2022/05/16 13:21:00.00,KIMBLESO,1392-35832,FELG(TK*),KIMB_232986_2022,FELG(TK*)/-:-/m,ASY,u,"'{culmenInMillimeters:36.1,theadInMilimeters:68.6, wingInMillimeters:172}'",123,12:30,51,,,
166,,uk,track,Red Knot Migration Study ECCC,2272951887,ECCC,2524,,Lotek,gps-pinpoint,,60,,,234233,,,,,,,28/5/2022,2022/05/28 16:03:00.00,MOORES,1392-35475,FELG(4M>),MOOR_234233_2022,FELG(4M>)/-:-/m,ASY,u,"'{culmenInMillimeters:40,theadInMilimeters:69.7, wingInMillimeters:174}'",156,15:35,28,,,
167,,uk,track,Red Knot Migration Study ECCC,2272951887,ECCC,2530,,Lotek,gps-pinpoint,,60,,,234234,,,,,,,28/5/2022,2022/05/28 16:03:00.00,MOORES,1392-35476,FELG(4L>),MOOR_234234_2022,FELG(4L>)/-:-/m,ASY,u,"'{culmenInMillimeters:36.8,theadInMilimeters:67.4, wingInMillimeters:170}'",203,15:35,28,,,
168,,uk,track,Red Knot Migration Study ECCC,2272951887,ECCC,2525,,Lotek,gps-pinpoint,,60,,,234235,,,,,,,28/5/2022,2022/05/28 16:14:00.00,MOORES,1392-35479,FELG(4H>),MOOR_234235_2022,FELG(4H>)/-:-/m,SY,u,"'{culmenInMillimeters:37.1,theadInMilimeters:64.8, wingInMillimeters:161}'",143,15:35,39,,,
169,,uk,track,Red Knot Migration Study ECCC,2272951887,ECCC,2528,,Lotek,gps-pinpoint,,60,,,234236,,,,,,,28/5/2022,2022/05/28 17:07:00.00,MOORES,1392-35480,FELG(4E>),MOOR_234236_2022,FELG(4E>)/-:-/m,ASY,u,"'{culmenInMillimeters:34.7,theadInMilimeters:62.7, wingInMillimeters:169}'",192,15:35,92,,,
170,,uk,track,Red Knot Migration Study ECCC,2272951887,ECCC,2537,,Lotek,gps-pinpoint,,60,,,234237,,,,,,,30/5/2022,2022-05-30  18:20:00 PM,FORTESCU,1392-35151,FELG(5Y>),FORT_234237_2022,FELG(5Y>)/-:-/m,ASY,u,"'{culmenInMillimeters:35.4,theadInMilimeters:65.1, wingInMillimeters:170}'",150,17:50:00 AM,30,,,
171,,uk,track,Red Knot Migration Study ECCC,2272951887,ECCC,2526,,Lotek,gps-pinpoint,,60,,,234238,,,,,,,30/5/2022,2022/05/30 18:17:00,FORTESCU,1332-64736,FELG(=16),FORT_234238_2022,FELG(=16)/-:-/m,ASY,u,"'{culmenInMillimeters:31.8,theadInMilimeters:62.3, wingInMillimeters:168}'",192,5:50:00 pm,27,,,
172,,uk,track,Red Knot Migration Study ECCC,2272951887,ECCC,2529,,Lotek,gps-pinpoint,,60,,,234239,,,,,,,30/5/2022,2022/05/30 18:09:00,FORTESCU,1332-69115,FELG(4C>),FORT_234239_2022,FELG(4C>)/-:-/m,ASY,u,"'{culmenInMillimeters:37.3,theadInMilimeters:66.6, wingInMillimeters:172}'",195,5:50:00 pm,19,,,
173,,,track,Red Knot Migration Study ECCC,2272951887,ECCC,2523,,Lotek,gps-pinpoint,,60,,,234240,,,,,,,30/5/2022,2022/05/30 18:05:00,FORTESCU,9822-04691,FEO(C3J),FORT_234240_2022,FEO(C3J)/m:R/-,ASY,u,"'{culmenInMillimeters:32.1,theadInMilimeters:63, wingInMillimeters:179}'",211,5:50:00 pm,15,,,
175,"error with tag deployment , limited data",uk,failed,Red Knot Migration Study ECCC,2272951887,ECCC,42233,21765,Lotek,sunbird,,60,,,238539,,,Antonio,-31.822657,-50.56216,,21/4/2023,2023/04/21 00:00:00.00,PESCA,H87428,?,PESCA_238539_2023,?,ASY,u ,"'{culmenInMillimeters:38,theadInMilimeters:67, wingInMillimeters:175}'",170,,,,,
176,NOT DEPLOYED (OCT 2023) defective tag -  sent back to Steph with replacement ,NA,not_deployed,Red Knot Migration Study ECCC,2272951887,ECCC,42234,21765,Lotek,sunbird,,60,,,238540,,,,,,,,,,,,,,,,,,,,,,
177,,,not_deployed,Red Knot Migration Study ECCC,2272951887,ECCC,42235,21765,Lotek,sunbird,,60,,,238541,,,,,,,16/5/2023,2023/04/16 00:28:00.00,MOORES,1332-67576,FELG(3V7),MOOR_238541_2023,FELG(3V7)/-:-/m,ASY,u ,"'{culmenInMillimeters:39.9,theadInMilimeters:69.8, wingInMillimeters:180}'",130,11:14,74,,,
178,"error on deployment in Lago de pesca, redeployed later in NBRIG ",,track ,Red Knot Migration Study ECCC,2272951887,ECCC,42236,21765,Lotek,sunbird,,,,,238542,blood and Feather taken,SB/monofilament nylon),,,,,15/8/2023,2023/08/15 13:30:00.00,NBRIG,1332-64616,FEDG(EYM),NBRIG_238542_2023,FEDG(EYM)/-:-/m,ASY,u,"'{culmenInMillimeters:34.5,theadInMilimeters:63.6, wingInMillimeters:172}'",167,15:32,132,,,
179,,uk,track,Red Knot Migration Study ECCC,2272951887,ECCC,42237,21765,Lotek,sunbird,,60,,,238543,,,,,,,16/5/2023,2023/05/16 11:14:00.00,MOORES,1392-24884,FELG(*EP),MOOR_238543_2023,FELG(*EP)/-:-/m,ASY,u ,"'{culmenInMillimeters:40,theadInMilimeters:69.6, wingInMillimeters:171}'",143,11:14,61,,,
180,,uk,track,Red Knot Migration Study ECCC,2272951887,ECCC,42238,21765,Lotek,sunbird,,60,,,238544,,,,,,,14/5/2023,2023/05/14 11:43:00.00,MOORES,802-64261,FEW(EPV),MOOR_238544_2023,'-/m:FEW(EPV)/-,ASY,u ,"'{culmenInMillimeters:36.5,theadInMilimeters:64.9, wingInMillimeters:167}'",138,10:33,70,,,
181,"error with tag deployment , limited data",,failed,Red Knot Migration Study ECCC,2272951887,ECCC,42239,21765,Lotek,sunbird,,60,,,238545,,,Antonio,-31.822657,-50.56216,,21/4/2023,2023/04/21 00:00:00.00,PESCA,H87429,?,PESCA_238545_2023,?,ASY,u ,"'{culmenInMillimeters:37,theadInMilimeters:65.1, wingInMillimeters:175}'",184,,,,,
182,,uk,track,Red Knot Migration Study ECCC,2272951887,ECCC,42240,21765,Lotek,sunbird,,60,,,238546,,,,,,,16/5/2023,2023/05/16 00:15:00.00,MOORES,1332-68967,FELG(+00),MOOR_238546_2023,FELG(+00)/-:-/m,ASY,u ,"'{culmenInMillimeters:36.1,theadInMilimeters:65.6, wingInMillimeters:174}'",140,11:14,43,,,
183,"error with tag deployment , limited data",,failed,Red Knot Migration Study ECCC,2272951887,ECCC,42241,21765,Lotek,sunbird,,60,,,238547,,,Antonio,-31.822657,-50.56216,,21/4/2023,2023/04/21 00:00:00.00,PESCA,H87434,?,PESCA_238547_2023,?,ASY,u ,"'{culmenInMillimeters:35,theadInMilimeters:63, wingInMillimeters:177}'",176,,,,,
184,"error with tag deployment , limited data",no points,failed,Red Knot Migration Study ECCC,2272951887,ECCC,42242,21765,Lotek,sunbird,,60,,,238548,,,Antonio,-31.822657,-50.56216,,21/4/2023,2023/04/21 00:00:00.00,PESCA,H87433,?,PESCA_238548_2023,?,ASY,u ,"'{culmenInMillimeters:35,theadInMilimeters:64, wingInMillimeters:166}'",189,,,,,
185,NOT DEPLOYED (October 2023),tested in Lago Pesca (not deplopyed) Returned to Steph mid may ,not_deployed,Red Knot Migration Study ECCC,2272951887,ECCC,42243,21765,Lotek,sunbird,,,,,238549,,,,,,,,,,,,,,,,,,,,,,
186,"error with tag deployment , limited data",,failed,Red Knot Migration Study ECCC,2272951887,ECCC,42244,21765,Lotek,sunbird,,60,,,238550,,,Antonio,-31.822657,-50.56216,,21/4/2023,2023/04/21 00:00:00.00,PESCA,H87434,?,PESCA_238550_2023,?,ASY,u,"'{culmenInMillimeters:37.1,theadInMilimeters:67, wingInMillimeters:172}'",195,,,,,
187,"error with tag deployment , limited data",,failed,Red Knot Migration Study ECCC,2272951887,ECCC,42245,21765,Lotek,sunbird,,60,,,238551,,,Antonio,-31.822657,-50.56216,,21/4/2023,2023/04/21 00:00:00.00,PESCA,H87438,FEB(H5N),PESCA_238551_2023,FEB(H5N),ASY,u,"'{culmenInMillimeters:36,theadInMilimeters:67, wingInMillimeters:170}'",199,,,,,
188,NOT DEPLOYED (October 2023),tested in Lago Pesca (not deplopyed),not_deployed,Red Knot Migration Study ECCC,2272951887,ECCC,42246,21765,Lotek,sunbird,,60,,,238552,,,,,,,,,,,,,,,,,,,,,,
189,"error with tag deployment , limited data",,failed,Red Knot Migration Study ECCC,2272951887,ECCC,42247,21765,Lotek,sunbird,,60,,,238553,,,Antonio,-31.822657,-50.56216,,21/4/2023,2023/04/21 00:00:00.00,PESCA,H87432,?,PESCA_238553_2023,?,ASY,u,"'{culmenInMillimeters:39,theadInMilimeters:68, wingInMillimeters:175}'",199,,,,,
190,NOT DEPLOYED - October 2023- ECCC (Christian Friis),,not_deployed,,,ECCC,58159,21765,Lotek,gps-pinpoint,,60,,,238554,,,,,,,,,,,,,,,,,,,,,,
191,Missing REF - reed beach - 2023-05-14),,track,,,ECCC,58160,21765,Lotek,gps-pinpoint,,60,,,238555,,,,,,,,,,,,,,,,,,,,,,
192,NOT DEPLOYED - October 2023- ECCC (Christian Friis),,not_deployed,,,ECCC,58161,21765,Lotek,gps-pinpoint,,60,,,238556,,,,,,,,,,,,,,,,,,,,,,
193,Missing REF -tag error - lots of spatial errors - reeds Beach 2023-05-14,,track,,,ECCC,58162,21765,Lotek,gps-pinpoint,,60,,,238557,,,,,,,,,,,,,,,,,,,,,,
194,NOT DEPLOYED - October 2023- ECCC (Christian Friis),,not_deployed,,,ECCC,58163,21765,Lotek,gps-pinpoint,,60,,,238558,,,,,,,,,,,,,,,,,,,,,,
195,NOT DEPLOYED - October 2023- ECCC (Christian Friis),,not_deployed,,,ECCC,58164,21765,Lotek,gps-pinpoint,,60,,,238559,,,,,,,,,,,,,,,,,,,,,,
196,NOT DEPLOYED - October 2023- ECCC (Christian Friis),,not_deployed,,,ECCC,58165,21765,Lotek,gps-pinpoint,,60,,,238560,,,,,,,,,,,,,,,,,,,,,,
197,Missing REF - reed beach - 2023-05-14,,track,,,ECCC,58166,21765,Lotek,gps-pinpoint,,60,,,238561,,,,,,,,,,,,,,,,,,,,,,
198,NOT DEPLOYED - October 2023- Charging problem (Christian Friis),,not_deployed,,,ECCC,58167,21765,Lotek,gps-pinpoint,,60,,,238562,,,,,,,,,,,,,,,,,,,,,,
199,NOT DEPLOYED - October 2023- ECCC (Christian Friis),,not_deployed,,,ECCC,58168,21765,Lotek,gps-pinpoint,,60,,,238563,,,,,,,,,,,,,,,,,,,,,,
200,NOT DEPLOYED - October 2023- ECCC (Christian Friis),,not_deployed,,,ECCC,58169,21765,Lotek,gps-pinpoint,,60,,,238564,,,,,,,,,,,,,,,,,,,,,,
201,NOT DEPLOYED - October 2023- ECCC (Christian Friis),,not_deployed,,,ECCC,58170,21765,Lotek,gps-pinpoint,,60,,,238565,,,,,,,,,,,,,,,,,,,,,,
202,Missing REF - reed beach - 2023-05-14,,not_deployed,,,ECCC,58171,21765,Lotek,gps-pinpoint,,60,,,238566,,,,,,,,,,,,,,,,,,,,,,
203,NOT DEPLOYED - October 2023- Charging problem (Christian Friis),,not_deployed,,,ECCC,58172,21765,Lotek,gps-pinpoint,,60,,,238567,,,,,,,,,,,,,,,,,,,,,,
204,NOT DEPLOYED - October 2023- ECCC (Christian Friis),,not_deployed,,,ECCC,58173,21765,Lotek,gps-pinpoint,,60,,,238568,,,,,,,,,,,,,,,,,,,,,,
205,NOT DEPLOYED - October 2023- ECCC (Christian Friis),,not_deployed,,,ECCC,58174,21765,Lotek,gps-pinpoint,,60,,,238569,,,,,,,,,,,,,,,,,,,,,,
206,Missing REF - reed beach - 2023-05-14,,track,,,ECCC,58175,21765,Lotek,gps-pinpoint,,60,,,238570,,,,,,,,,,,,,,,,,,,,,,
207,NOT DEPLOYED - October 2023- ECCC (Christian Friis),,not_deployed,,,ECCC,58176,21765,Lotek,gps-pinpoint,,60,,,238571,,,,,,,,,,,,,,,,,,,,,,
208,NOT DEPLOYED - October 2023- ECCC (Christian Friis),,not_deployed,,,ECCC,58177,21765,Lotek,gps-pinpoint,,60,,,238572,,,,,,,,,,,,,,,,,,,,,,
209,NOT DEPLOYED - October 2023- ECCC (Christian Friis),,not_deployed,,,ECCC,58178,21765,Lotek,gps-pinpoint,,60,,,238573,,,,,,,,,,,,,,,,,,,,,,
210,NOT DEPLOYED - October 2023- ECCC (Christian Friis),,not_deployed,,,ECCC,58179,21765,Lotek,gps-pinpoint,,60,,,238574,,,,,,,,,,,,,,,,,,,,,,
211,NOT DEPLOYED - October 2023- ECCC (Christian Friis),,not_deployed,,,ECCC,58180,21765,Lotek,gps-pinpoint,,60,,,238575,,,,,,,,,,,,,,,,,,,,,,
212,Missing REF - reed beach - 2023-05-14,possible tag errors?,track ,,,ECCC,58181,21765,Lotek,gps-pinpoint,,60,,,238576,,,,,,,,,,,,,,,,,,,,,,
213,NOT DEPLOYED - October 2023- ECCC (Christian Friis),,not_deployed,,,ECCC,58182,21765,Lotek,gps-pinpoint,,60,,,238577,,,,,,,,,,,,,,,,,,,,,,
214,NOT DEPLOYED - October 2023- ECCC (Christian Friis),,not_deployed,,,ECCC,58183,21765,Lotek,gps-pinpoint,,60,,,238578,,,,,,,,,,,,,,,,,,,,,,
215,Missing REF - reed beach - 2023-05-14,,track ,,,ECCC,58184,21765,Lotek,gps-pinpoint,,60,,,238579,,,,,,,,,,,,,,,,,,,,,,
216,NOT DEPLOYED - October 2023- ECCC (Christian Friis),,not_deployed,,,ECCC,58185,21765,Lotek,gps-pinpoint,,60,,,238580,,,,,,,,,,,,,,,,,,,,,,
217,NOT DEPLOYED - October 2023- ECCC (Christian Friis),,not_deployed,,,ECCC,58186,21765,Lotek,gps-pinpoint,,60,,,238581,,,,,,,,,,,,,,,,,,,,,,
218,Missing REF - reed beach - 2023-05-14,possible tag errors?,track ,,,ECCC,58187,21765,Lotek,gps-pinpoint,,60,,,238582,,,,,,,,,,,,,,,,,,,,,,
219,NOT DEPLOYED - October 2023- ECCC (Christian Friis),,not_deployed,,,ECCC,58188,21765,Lotek,gps-pinpoint,,60,,,238583,,,,,,,,,,,,,,,,,,,,,,
220,Missing REF - no data on argos platform,,not_deployed,,,ECCC,58195,21765,Lotek,gps-pinpoint,,60,,,238590,,,,,,,,,,,,,,,,,,,,,,
,,,not_deployed,,,ECCC,,,,,,,,,238595,,,,,,,,,,,,,,,,,,,,,,
,,,not_deployed,,,ECCC,,,,,,,,,238596,,,,,,,,,,,,,,,,,,,,,,
221,Missing REF - no data on argos platform,,not_deployed,,,ECCC,58213,21765,Lotek,gps-pinpoint,,60,,,238608,,,,,,,,,,,,,,,,,,,,,,
222,,TDF,track,Red Knot Migration Study ECCC,2272951887,ECCC,42827,21765,Lotek,Sunbird,,60,,,240155,,,Larry,-31.290044,-50.955205,,10/4/2023,2023/04/10 12:00:00.00,PEIXE,H87424,FEB(H5P),PEIXE_240155_2023,FEB(H5P),ASY,u,"'{culmenInMillimeters:36,theadInMilimeters:64, wingInMillimeters:179}'",171,,,,,
223,,uk,track,Red Knot Migration Study ECCC,2272951887,ECCC,42828,21765,Lotek,Sunbird,,60,,,240156,,,,,,,16/5/2023,2023-05-16  13:09:00 AM,MOORES,1172-78992,FEW(JKA),MOOR_240156_2023,-/m:FEW(JKA)/-,ASY,u,"'{culmenInMillimeters:36.2,theadInMilimeters:65.8, wingInMillimeters:177}'",105,11:14,114,,,
224,,TDF,track,Red Knot Migration Study ECCC,2272951887,ECCC,42829,21765,Lotek,Sunbird,,60,,,240157,,,Larry,-31.290044,-50.955205,,10/4/2023,2023/04/10 12:00:00.00,PEIXE,H87418,FEB(H6K),PEIXE_240157_2023,FEB(H6K),ASY,u,"'{culmenInMillimeters:35.3,theadInMilimeters:65.2, wingInMillimeters:182}'",151,,,,,
225,,TDF,track,Red Knot Migration Study ECCC,2272951887,ECCC,42830,21765,Lotek,Sunbird,,60,,,240158,,,Larry,-31.290044,-50.955205,,10/4/2023,2023/04/10 12:00:00.00,PEIXE,H87419,FEB(H6J),PEIXE_240158_2023,FEB(H6J),ASY,u,"'{culmenInMillimeters:34.2,theadInMilimeters:62.8, wingInMillimeters:170}'",159,,,,,
226,,TDF,track,Red Knot Migration Study ECCC,2272951887,ECCC,42831,21765,Lotek,Sunbird,,60,,,240159,,,Larry,-31.290044,-50.955205,,10/4/2023,2023/04/10 12:00:00.00,PEIXE,H87422,FEB(H6C),PEIXE_240159_2023,FEB(H6C),ASY,u,"'{culmenInMillimeters:36.3,theadInMilimeters:66.5, wingInMillimeters:168}'",141,,,,,
227,,TDF,track,Red Knot Migration Study ECCC,2272951887,ECCC,42832,21765,Lotek,Sunbird,,60,,,240160,,,Larry ,-31.290044,-50.955205,,10/4/2023,2023/04/10 12:00:00.00,PEIXE,H87421,FEB(H6E),PEIXE_240160_2023,FEB(H6E),ASY,u,"'{culmenInMillimeters:33.8,theadInMilimeters:63.2, wingInMillimeters:168}'",122,,,,,
228,,uk,track,Red Knot Migration Study ECCC,2272951887,ECCC,42833,21765,Lotek,Sunbird,,60,,,240161,,,,,,,16/5/2023,2023/05/16 11:53:00.00,MOORES,1332-54994,FEDG(J19),MOOR_240161_2023,FEDG(J19)/-:-/m,ASY,u,"'{culmenInMillimeters:34.7,theadInMilimeters:63.6, wingInMillimeters:169}'",114,,,,,
229,,TDF,track,Red Knot Migration Study ECCC,2272951887,ECCC,42834,21765,Lotek,Sunbird,,60,,,240162,,,Larry ,-31.290044,-50.955205,,10/4/2023,2023/04/10 12:00:00.00,PEIXE,H87420,FEB(H6H),PEIXE_240162_2023,FEB(H6H),ASY,u ,"'{culmenInMillimeters:34.3,theadInMilimeters:62.2, wingInMillimeters:177}'",122,,,,,
230,,TDF,track,Red Knot Migration Study ECCC,2272951887,ECCC,42835,21765,Lotek,Sunbird,,60,,,240163,,,Steph ,-31.353038,-50.032,,11/4/2023,2023/04/11 12:00:00.00,PEIXE,H87427,FEB(H5M),PEIXE_240163_2023,FEB(H5M),ASY,u ,"'{culmenInMillimeters:35.8,theadInMilimeters:63.2, wingInMillimeters:167}'",121,,,,,
231,,TDF,track,Red Knot Migration Study ECCC,2272951887,ECCC,42836,21765,Lotek,Sunbird,,60,,,240164,,,Larry ,-31.290044,-50.955205,,10/4/2023,2023/04/10 12:00:00.00,PEIXE,H87425,FEB(H5K),PEIXE_240164_2023,FEB(H5K),ASY,u,"'{culmenInMillimeters:32.4,theadInMilimeters:61.6, wingInMillimeters:168}'",161,,,,,
232,,TDF,track,Red Knot Migration Study ECCC,2272951887,ECCC,42837,21765,Lotek,Sunbird,,60,,,240165,,,Larry ,-31.290044,-50.955205,,10/4/2023,2023/04/10 12:00:00.00,PEIXE,133255821,FDJ(JEK),PEIXE_240165_2023,"FDJ(JEK)/-,-/M",ASY,u,"'{culmenInMillimeters:37.3,theadInMilimeters:66.4, wingInMillimeters:149}'",149,,,,,
233,,TDF,track,Red Knot Migration Study ECCC,2272951887,ECCC,42838,21765,Lotek,Sunbird,,60,,,240166,,,Larry,-31.290044,-50.955205,,10/4/2023,2023/04/10 12:00:00.00,PEIXE,H87426,FEB(H5L),PEIXE_240166_2023,FEB(H5L),ASY,u,"'{culmenInMillimeters:33.7,theadInMilimeters:60, wingInMillimeters:166}'",149,,,,,
234,,TDF,track,Red Knot Migration Study ECCC,2272951887,ECCC,42839,21765,Lotek,Sunbird,,60,,,240167,,,Larry,-31.290044,-50.955205,,10/4/2023,2023/04/10 12:00:00.00,PEIXE,H87423,FEB(H6A),PEIXE_240167_2023,FEB(H6A),ASY,u,"'{culmenInMillimeters:40,theadInMilimeters:69.8, wingInMillimeters:180}'",160,,,,,
235,,uk,track,Red Knot Migration Study ECCC,2272951887,ECCC,42840,21765,Lotek,Sunbird,,60,,,240168,,,,,,,16/5/2023,2023-05-16  13:00:00 AM,MOORES,1332-98117,FEDG(J25),MOOR_240168_2023,FEDG(J25)/-:-/m,ASY,u,"'{culmenInMillimeters:36.6,theadInMilimeters:65.6, wingInMillimeters:165}'",114,11:14,106,,,
236,,uk,track,Red Knot Migration Study ECCC,2272951887,ECCC,42841,,Lotek,Sunbird,,,,,240169,,,,,,,16/5/2023,2023-05-16  13:35:00 AM,MOORES,1392-35252,FELG(6>M),MOOR_240169_2023,FELG(6>M)/:-/m,ASY,u,"'{culmenInMillimeters:36.7,theadInMilimeters:65.3, wingInMillimeters:166}'",101,11:14,13:35,,,
237,missing REF,,not_deployed,,,ECCC,42842,,Lotek,Sunbird,,,,,240170,,,,,,,,,,,,,,,,,,,,,,
238,NZ only? Deployed?,,not_deployed,,,ECCC,42843,,Lotek,Sunbird,,,,,240171,,,,,,,,,,,,,,,,,,,,,,
239,missing REF,,not_deployed,,,ECCC,42844,,Lotek,Sunbird,,,,,240172,,,,,,,,,,,,,,,,,,,,,,
240,NZ only? Deployed?,,not_deployed,,,ECCC,42845,,Lotek,Sunbird,,,,,240173,,,,,,,,,,,,,,,,,,,,,,
241,NZ only? Deployed?,,not_deployed,,,ECCC,42846,,Lotek,Sunbird,,,,,240174,,,,,,,,,,,,,,,,,,,,,,
242,NZ only? Deployed?,,not_deployed,,,ECCC,42847,,Lotek,Sunbird,,,,,240175,,,,,,,,,,,,,,,,,,,,,,
243,,TDF,track,Red Knot Migration Study ECCC,2272951887,ECCC,,,?,microwave telemetry ,,,,,241166,,,Larry ,-31.329307,-50.988404,,,45024.5,PEIXE,H87416,FEB(H5H),PEIXE_241166_2023,FEB(H5H),ASY,u,"'{culmenInMillimeters:34.7,theadInMilimeters:61.1, wingInMillimeters:160}'",149,,,,,
244,,TDF,track,Red Knot Migration Study ECCC,2272951887,ECCC,,,?,microwave telemetry ,,,,,241167,,,Larry ,-31.329307,-50.988404,,,45024.5,PEIXE,H87417,FEB(H5J),PEIXE_241167_2023,FEB(H5J),ASY,u,"'{culmenInMillimeters:32.9,theadInMilimeters:60.8, wingInMillimeters:170}'",139,,,,,
245,,uk,track,Red Knot Migration Study ECCC,2272951887,ECCC,43363,,Lotek,Sunbird,,,,,242570,,,,,,,19/5/2023,2023/05/19 12:00:00.00,EASTPIT,1332-68228,FELG(=KH),EAST_242570_2023,FELG(=KH)/-:-/m,ASY,u ,"'{culmenInMillimeters:40.6,theadInMilimeters:66.9, wingInMillimeters:172}'",178,11:20,46,,,
246,,uk,track,Red Knot Migration Study ECCC,2272951887,ECCC,43364,,Lotek,Sunbird,,,,,242571,,Monofilament nylon,,,,,19/5/2023,2023/05/19 12:00:00.00,EASTPIT,1332-69930,FELG(KA=),EAST_242571_2023,FELG(KA=)/-:-/m,ASY,u,"'{culmenInMillimeters:34.5,theadInMilimeters:64.3, wingInMillimeters:170}'",163,11:20,40,,,
247,Missing REF - reed beach - 2023-05-14,,track,,,ECCC,43365,,Lotek,Sunbird,,,,,242572,,,,,,,,,,,,,,,,,,,,,,
248,,uk,track,Red Knot Migration Study ECCC,2272951887,ECCC,43366,,Lotek,Sunbird,,,,,242573,capt color (FEB(A6M)/-:-/-),,,,,,16/5/2023,2023-04-08  13:41:00 PM,MOORES,1392-25660,FEB(E1K),MOOR_242573_2023,FEB(A6M)/-:-/-,ASY,u ,"'{culmenInMillimeters:36.9,theadInMilimeters:67, wingInMillimeters:174}'",127,11:14,13:41,,,
249,,uk,track,Red Knot Migration Study ECCC,2272951887,ECCC,43367,,Lotek,Sunbird,,,,,242574,,,,,,,16/5/2023,2023-04-08  13:41:00 PM,MOORES,1392-24770,FELG(KA*),MOOR_242574_2023,FELG(KA*)/-:-/m,ASY,u ,"'{culmenInMillimeters:37.9,theadInMilimeters:67.3, wingInMillimeters:166}'",104,11:14,77,,,
250,,,track,Red Knot Migration Study ECCC,2272951887,ECCC,43368,,Lotek,Sunbird,,,,,242575,SB/monofilament nylon,blood taken,,,,,15/8/2023,2023-08-15  13:30:00 PM,NBRIG,1332-26461,FEDG(K72),NBRIG_242575_2023,FEDG(K72)/-:-/m,ASY,u ,"{culmenInMillimeters:36.6,theadInMilimeters:67.4, wingInMillimeters:166}'",193,13:30,84,,,
251,,,track,Red Knot Migration Study ECCC,2272951887,ECCC,43369,,Lotek,Sunbird,,,,,242576,SB/monofilament nylon,blood taken,,,,,15/8/2023,2023-08-15  13:30:00 PM,NBRIG,1332-26478,FEDG(K90),NBRIG_242576_2023,FEDG(K90)/-:-/m,ASY,u ,"{culmenInMillimeters:36.5,theadInMilimeters:66.9, wingInMillimeters:165}'",180,13:30,135,,,
252,,,track,Red Knot Migration Study ECCC,2272951887,ECCC,43370,,Lotek,Sunbird,,,,,242577,,,,,,,19/5/2023,2023/05/19 12:24:00.00,EASTPIT,1392-25641,FEDG(J17),EAST_242577_2023,FEDG(J17)/-:-/m,ASY,u ,"'{culmenInMillimeters:35.4,theadInMilimeters:65.4, wingInMillimeters:170}'",144,11:20,64,,,
253,,,track,Red Knot Migration Study ECCC,2272951887,ECCC,43371,,Lotek,Sunbird,,,,,242578,sb polyester tag,feather and blood taken,,,,,15/8/2023,2023-08-15  13:30:00 PM,NBRIG,1392-24959,FELG(XJ>),NBRIG_242578_2023,FELG(XJ>)/-:-/m,ASY,u ,"{culmenInMillimeters:34.8,theadInMilimeters:63.6, wingInMillimeters:164}'",176,13:30,130,,,
254,,,not_deployed,,,ECCC,43372,,Lotek,Sunbird,,,,,242579,,,,,,,,,,,,,,,,,,,,,,
255,,,track,Red Knot Migration Study ECCC,2272951887,ECCC,43373,,Lotek,Sunbird,,,,,242580,,,,,,,19/5/2023,2023-05-19  12:60:00 PM,EASTPIT,1332-97010,FELG(L+L),EAST_242580_2023,FELG(L+L)/-:-m,ASY,u ,"'{culmenInMillimeters:34.9,theadInMilimeters:63.9, wingInMillimeters:169}'",117,11:20,55,,,
256,NOT DEPLOYED (October 2023),,not_deployed,,,ECCC,43374,,Lotek,Sunbird,,,,,242581,,,,,,,,,,,,,,,,,,,,,,
259,last record is mortaility flag ,,track,Red Knot Fall MA Migration Study,2272938482,CWF/MA Migration,2607,28165,Lotek,Lotek PinPoint GPS-Argos 75,4.1,,5 hrs,,236444,other,Glue and suture attachment. 4.1-g Lotek PinPoint GPS-Argos 75. Programmed to attempt a GPS location every 5 hours. Tag collects approx. 60 locations total.,Feigin,41.63566,-69.96948,FELG(5T>)-236444,,00:00.0,MA,1392-56602,,FELG(5T>),FELG(5T>)/-:-/m,ASY,,,,,,,,
260,,,track,Red Knot Fall MA Migration Study,2272938482,CWF/MA Migration,2608,28165,Lotek,Lotek PinPoint GPS-Argos 75,4.1,,5 hrs,,236445,other, Glue and suture attachment. 4.1-g Lotek PinPoint GPS-Argos 75. Programmed to attempt a GPS location every 5 hours. Tag collects approx. 60 locations total.,Feigin,41.63566,-69.96948,FELG(9P>)-236445,,00:00.0,MA,1392-56609,,FELG(9P>),FELG(9P>)/-:-/m,ASY,,,,,,,,
261,,,track,Red Knot Fall MA Migration Study,2272938482,CWF/MA Migration,2609,28165,Lotek,Lotek PinPoint GPS-Argos 75,4.1,,5 hrs,,236446,other,Glue and suture attachment. 4.1-g Lotek PinPoint GPS-Argos 75. Programmed to attempt a GPS location every 5 hours. Tag collects approx. 60 locations total.,Feigin,41.63566,-69.96948,FELG(9T>)-236446,,00:00.0,MA,1392-56608,,FELG(9T>),FELG(9T>)/-:-/m,ASY,,,,,,,,
262,,,track,Red Knot Fall MA Migration Study,2272938482,CWF/MA Migration,2610,28165,Lotek,Lotek PinPoint GPS-Argos 75,4.1,,5 hrs,,236451,,Glue and suture attachment. 4.1-g Lotek PinPoint GPS-Argos 75. Programmed to attempt a GPS location every 5 hours. Tag collects approx. 60 locations total.,Feigin,41.63566,-69.96948,FELG(9U>)-236451,,00:00.0,MA,1392-56607,,FELG(9U>),FELG(9U>)/-:-/m,ASY,,,,,,,,
263,,,track,Red Knot Fall MA Migration Study,2272938482,CWF/MA Migration,2611,28165,Lotek,Lotek PinPoint GPS-Argos 75,4.1,,5 hrs,Recorded incorrectly on field sheet as 1392-24128,236450,other,Glue and suture attachment. 4.1-g Lotek PinPoint GPS-Argos 75. Programmed to attempt a GPS location every 5 hours. Tag collects approx. 60 locations total.,Feigin,41.63566,-69.96948,FELG(9V>)-236450,,00:00.0,MA,1392-56606,,FELG(9V>),FELG(9V>)/-:-/m,ASY,,,,,,,,
264,,,track,Red Knot Fall MA Migration Study,2272938482,CWF/MA Migration,2612,28165,Lotek,Lotek PinPoint GPS-Argos 75,4.1,,5 hrs,,236447,other,Glue and suture attachment. 4.1-g Lotek PinPoint GPS-Argos 75. Programmed to attempt a GPS location every 5 hours. Tag collects approx. 60 locations total.,Feigin,41.63566,-69.96948,FELG(K48)-236447,,00:00.0,MA,1332-53814,,FELG(K48),FELG(K48)/-:-/m,ASY,,,,,,,,
265,,,track,Red Knot Fall MA Migration Study,2272938482,CWF/MA Migration,2613,28165,Lotek,Lotek PinPoint GPS-Argos 75,,,,,236448,,,Feigin,,,FEDG(J00)-236448,14/5/2023,2023/05/14 10:33:00.00,MOORES,1392-35187,,FEDG(J00),FEDG(J00)/-:-/m,ASY,u,"'{culmenInMillimeters:33.5,theadInMilimeters:62.7, wingInMillimeters:167}'",145,10:33,37,,,
266,,,track,Red Knot Fall MA Migration Study,2272938482,CWF/MA Migration,2614,28165,Lotek,Lotek PinPoint GPS-Argos 75,,,,,236449,,,Feigin,,,FEDG(J06)-236449,14/5/2023,2023/05/14 11:35:00.00,MOORES,1392-35193,,FEDG(J06),FEDG(J06)/-:-/m,ASY,u,"'{culmenInMillimeters:32.8,theadInMilimeters:63.1, wingInMillimeters:172}'",135,10:33,62,,,
267,,,track,Red Knot Fall MA Migration Study,2272938482,CWF/MA Migration,2615,28165,Lotek,Lotek PinPoint GPS-Argos 75,,,,,236452,,,Feigin,,,FEDG(J05)-236452,14/5/2023,2023/05/14 11:35:00.00,MOORES,1392-35192,,FEDG(J05),FEDG(J05)/-:-/m,ASY,u,"'{culmenInMillimeters:35.6,theadInMilimeters:64.9, wingInMillimeters:178}'",164,10:33,62,,,
268,,,track,Red Knot Fall MA Migration Study,2272938482,CWF/MA Migration,2616,28165,Lotek,Lotek PinPoint GPS-Argos 75,,,,,236453,,,Feigin,,,FEDG(J02)-236453,14/5/2023,2023/05/14 10:33:00.00,MOORES,1392-35189,,FEDG(J02),FEDG(J02)/-:-/m,ASY,u,"'{culmenInMillimeters:37.0,theadInMilimeters:64.7, wingInMillimeters:172}'",145,10:33,37,,,
58,,,track,Red Knot Atlantic Shores,1235069252,Atlantic Shores,55158,7165,Lotek,Lotek PinPoint GPS-Argos 75,,,,,224089,,,,,,,25/8/2021,2021/08/25 15:58:00.00,NBRIG,1392-24962,,,FELG(XM>)/-:-/m,ASY,u,"'{culmenInMillimeters:36.5,theadInMilimeters:64.7, wingInMillimeters:164}'",160,15:00,58,,,
47,,,failed,Red Knot Atlantic Shores,1235069252,Atlantic Shores,55159,7165,Lotek,Lotek PinPoint GPS-Argos 75,,,,,224090,,,,,,,23/8/2021,2021/08/23 00:00:00.00,NBRIG,1392-35723,,,FELG(*VV)/-:-/m,ASY,u,"'{culmenInMillimeters:34.7,theadInMilimeters:62.8, wingInMillimeters:169}'",147,16:30,,,,
59,,,track,Red Knot Atlantic Shores,1235069252,Atlantic Shores,55160,7165,Lotek,Lotek PinPoint GPS-Argos 75,,,,,224091,,,,,,,25/8/2021,2021/08/25 16:02:00.00,NBRIG,1392-24963,,,FELG(XN>)/-:-/m,ASY,u,"'{culmenInMillimeters:34.5,theadInMilimeters:61.7, wingInMillimeters:172}'",138,15:00,62,,,
45,,,track,Red Knot Atlantic Shores,1235069252,Atlantic Shores,55161,7165,Lotek,Lotek PinPoint GPS-Argos 75,,,,,224092,,,,,,,23/8/2021,2021/08/23 16:55:00.00,NBRIG,1392-35718,,,FELG(*VL)/-:-/m,ASY,u,"'{culmenInMillimeters:35.5,theadInMilimeters:63.9, wingInMillimeters:169}'",163,16:30,25,,,
43,,,track,Red Knot Atlantic Shores,1235069252,Atlantic Shores,55162,7165,Lotek,Lotek PinPoint GPS-Argos 75,,,,,224093,,,,,,,20/8/2021,2021/08/20 13:12:00.00,NBRIG,1392-24954,,,FELG(*VJ)/-:-/m,ASY,u,"'{culmenInMillimeters:31.3,theadInMilimeters:60.4, wingInMillimeters:170}'",189,11:45,87,,,
32,,,track,Red Knot Atlantic Shores,1235069252,Atlantic Shores,55163,7165,Lotek,Lotek PinPoint GPS-Argos 75,,,,,224094,,,,,,,20/8/2021,2021/08/20 12:29:00.00,NBRIG,1392-24943,,,FELG(*TJ)/-:-/m,ASY,u,"'{culmenInMillimeters:33.5,theadInMilimeters:59, wingInMillimeters:160}'",149,11:45,44,,,
38,,,track,Red Knot Atlantic Shores,1235069252,Atlantic Shores,55164,7165,Lotek,Lotek PinPoint GPS-Argos 75,,,,,224095,,,,,,,20/8/2021,2021/08/20 12:58:00.00,NBRIG,1392-24949,,,FELG(*TU)/-:-/m,ASY,u,"'{culmenInMillimeters:36.8,theadInMilimeters:67.3, wingInMillimeters:174}'",202,11:45,73,,,
30,,,track,Red Knot Atlantic Shores,1235069252,Atlantic Shores,55165,7165,Lotek,Lotek PinPoint GPS-Argos 75,,,,,224096,,,,,,,20/8/2021,2021/08/20 12:17:00.00,NBRIG,1392-24941,,,FELG(*TC)/-:-/m,HY,u,"'{culmenInMillimeters:36,theadInMilimeters:64.3, wingInMillimeters:}'",169,11:45,32,,,
34,,,track,Red Knot Atlantic Shores,1235069252,Atlantic Shores,55166,7165,Lotek,Lotek PinPoint GPS-Argos 75,,,,,224097,,,,,,,20/8/2021,2021/08/20 12:37:00.00,NBRIG,1392-24945,,,FELG(*TL)/-:-/m,ASY,u,"'{culmenInMillimeters:35.8,theadInMilimeters:64.6, wingInMillimeters:165}'",175,11:45,52,,,
56,,,track,Red Knot Atlantic Shores,1235069252,Atlantic Shores,55167,7165,Lotek,Lotek PinPoint GPS-Argos 75,,,,,224098,,,,,,,25/8/2021,2021/08/25 15:53:00.00,NBRIG,1392-24960,,,FELG(XK>)/-:-/m,ASY,u,"'{culmenInMillimeters:37.1,theadInMilimeters:64.8, wingInMillimeters:170}'",192,15:00,53,,,
50,,,track,Red Knot Atlantic Shores,1235069252,Atlantic Shores,55168,7165,Lotek,Lotek PinPoint GPS-Argos 75,,,,,224099,,,,,,,23/8/2021,2021/08/23 17:44:00.00,NBRIG,1172-78640,,,-/m:FEW(ANK)/-,ASY,u,"'{culmenInMillimeters:37.7,theadInMilimeters:66.1, wingInMillimeters:171}'",201,16:30,74,,,
46,,,track,Red Knot Atlantic Shores,1235069252,Atlantic Shores,55169,7165,Lotek,Lotek PinPoint GPS-Argos 75,,,,,224100,,,,,,,23/8/2021,2021/08/23 00:00:00.00,NBRIG,1392-35719,,,FELG(*VM)/-:-/m,ASY,u,"'{culmenInMillimeters:36.6,theadInMilimeters:64.6, wingInMillimeters:170}'",152,16:30,,,,
44,,,track,Red Knot Atlantic Shores,1235069252,Atlantic Shores,55170,7165,Lotek,Lotek PinPoint GPS-Argos 75,,,,,224101,,,,,,,20/8/2021,2021/08/20 13:06:00.00,NBRIG,1332-55095,,,FELG(*VC)/-:-/m,ASY,u,"'{culmenInMillimeters:34.8,theadInMilimeters:62.8, wingInMillimeters:168}'",164,11:45,81,,,
54,,,track,Red Knot Atlantic Shores,1235069252,Atlantic Shores,55171,7165,Lotek,Lotek PinPoint GPS-Argos 75,,,,,224102,,,,,,,25/8/2021,2021/08/25 15:44:00.00,NBRIG,1392-24958,,,FELG(XH>)/-:-/m,ASY,u,"'{culmenInMillimeters:34.2,theadInMilimeters:63.1, wingInMillimeters:165}'",180,15:00,44,,,
37,,,track,Red Knot Atlantic Shores,1235069252,Atlantic Shores,55172,7165,Lotek,Lotek PinPoint GPS-Argos 75,,,,,224103,,,,,,,20/8/2021,2021/08/20 12:51:00.00,NBRIG,1392-24948,,,FELG(*TT)/-:-/m,ASY,u,"'{culmenInMillimeters:36.4,theadInMilimeters:66.2, wingInMillimeters:174}'",192,11:45,66,,,
285,"Missing REF , marked as not deployed in spring 2022 and will be deployed in NY 2023? Points have no geometry ?",,not_deployed,"Brazil, only 3 points",,Atlantic Shores,55545,17165,Lotek,Lotek PinPoint GPS-Argos 75,,60,,,229306,,,,,,,,,,,,,,,,,,,,,,
286,"Missing REF , marked as not deployed in spring 2022 and will be deployed in NY 2023? Points have no geometry ?",,not_deployed,"Brazil, only 3 points",,Atlantic Shores,55546,17165,Lotek,Lotek PinPoint GPS-Argos 75,,60,,,229307,,,,,,,,,,,,,,,,,,,,,,
287,Missing REF ,,failed,Brazil ,,Atlantic Shores,55548,17165,Lotek,Lotek PinPoint GPS-Argos 75,,60,,,229309,,,,,,,,,,,,,,,,,,,,,,
288,Missing REF ,,failed,Brazil ,,Atlantic Shores,55549,17165,Lotek,Lotek PinPoint GPS-Argos 75,,60,,,229310,,,,,,,,,,,,,,,,,,,,,,
289,"Missing REF , marked as not deployed in spring 2022 and will be deployed in NY 2023? Points have no geometry ?",,not_deployed,Brazil ,,Atlantic Shores,55550,17165,Lotek,Lotek PinPoint GPS-Argos 75,,60,,,229311,,,,,,,,,,,,,,,,,,,,,,
290,Missing REF ,,track,good dataset,1235069252,Atlantic Shores,55551,17165,Lotek,Lotek PinPoint GPS-Argos 75,,60,,,229312,,no reference data,,-31.245,-50.911,,19/4/2022,2022/04/19 09:18:00.00,LAGODOPEIXE,,,,,,,,,,,,,
291,"Missing REF , marked as not deployed in spring 2022 and will be deployed in NY 2023? Points have no geometry ?",,not_deployed,Brazil ,,Atlantic Shores,55552,17165,Lotek,Lotek PinPoint GPS-Argos 75,,60,,,229313,,,,,,,,,,,,,,,,,,,,,,
292,Missing REF ,,track,good dataset,1235069252,Atlantic Shores,55553,17165,Lotek,Lotek PinPoint GPS-Argos 75,,60,,,229314,,no reference data,,-31.245,-50.911,,19/4/2022,2022/04/19 09:18:00.00,LAGODOPEIXE,,,,,,,,,,,,,
293,Missing REF ,,failed,Brazil ,,Atlantic Shores,55554,17165,Lotek,Lotek PinPoint GPS-Argos 75,,60,,,229315,,,,,,,,,,,,,,,,,,,,,,
294,,,track,"SC tags, grouped with Atlantic Shores, see SC for deployemnt details (F.Sanders)",1235069252,Atlantic Shores,55555,17165,Lotek,Lotek PinPoint GPS-Argos 75,,60,,,229316,,blood taken,,32.577316,-80.144126,,20/4/2022,2022/04/20 00:00:00.00,KIAWAHWEST,1262-04574,,,FELG(4+7)/-:-/m,,u,"'{culmenInMillimeters:35.4,theadInMilimeters:65.5, wingInMillimeters:173}'",156,,,,,
295,,,track,"SC tags, grouped with Atlantic Shores, see SC for deployemnt details (F.Sanders)",1235069252,Atlantic Shores,55556,17165,Lotek,Lotek PinPoint GPS-Argos 75,,60,,,229317,,blood taken,,32.577316,-80.144126,,20/4/2022,2022/04/20 00:00:00.00,KIAWAHWEST,1332-24220,,,FELG(>0C)/-:-/m,,u,"'{culmenInMillimeters:31.7,theadInMilimeters:60.0, wingInMillimeters:168}'",140,,,,,
296,,,track,"SC tags, grouped with Atlantic Shores, see SC for deployemnt details (F.Sanders)",1235069252,Atlantic Shores,55558,17165,Lotek,Lotek PinPoint GPS-Argos 75,,60,,,229319,,blood taken,,32.577316,-80.144126,,20/4/2022,2022/04/20 00:00:00.00,KIAWAHWEST,1332-72201,,,FELG(+X7)/-:-/m,,u,"'{culmenInMillimeters:33.2,theadInMilimeters:64.9, wingInMillimeters:167}'",142,,,,,
297,,,track,"SC tags, grouped with Atlantic Shores, see SC for deployemnt details (F.Sanders)",1235069252,Atlantic Shores,55559,17165,Lotek,Lotek PinPoint GPS-Argos 75,,60,,,229320,,blood taken,,32.577316,-80.144126,,20/4/2022,2022/04/20 00:00:00.00,KIAWAHWEST,1262-04561,,,FELG(1+8)/-:-/m,,u,"'{culmenInMillimeters:36.1,theadInMilimeters:65.5, wingInMillimeters:170}'",154,,,,,
298,,,track,"SC tags, grouped with Atlantic Shores, see SC for deployemnt details (F.Sanders)",1235069252,Atlantic Shores,55560,17165,Lotek,Lotek PinPoint GPS-Argos 75,,60,,,229321,,blood taken,,32.577316,-80.144126,,20/4/2022,2022/04/20 00:00:00.00,KIAWAHWEST,1262-04557,,,FELG(1+5)/-:-/m,,u,"'{culmenInMillimeters:32.5,theadInMilimeters:60.9, wingInMillimeters:169}'",140,,,,,
299,,,track,"SC tags, grouped with Atlantic Shores, see SC for deployemnt details (F.Sanders)",1235069252,Atlantic Shores,55561,17165,Lotek,Lotek PinPoint GPS-Argos 75,,60,,,229322,,blood taken,,32.577316,-80.144126,,20/4/2022,2022/04/20 00:00:00.00,KIAWAHWEST,1332-72097,,,FELG(+A8)/-:-/m,,u,"'{culmenInMillimeters:35.6,theadInMilimeters:67.1, wingInMillimeters:177}'",142,,,,,
300,,,track,"SC tags, grouped with Atlantic Shores, see SC for deployemnt details (F.Sanders)",1235069252,Atlantic Shores,55562,17165,Lotek,Lotek PinPoint GPS-Argos 75,,60,,,229323,,blood taken,,32.577316,-80.144126,,20/4/2022,2022/04/20 00:00:00.00,KIAWAHWEST,1332-72212,,,FELG(+T3)/-:-/m,,u,"'{culmenInMillimeters:37.2,theadInMilimeters:67.4, wingInMillimeters:166}'",140,,,,,
301,,,track,"SC tags, grouped with Atlantic Shores, see SC for deployemnt details (F.Sanders)",1235069252,Atlantic Shores,55563,17165,Lotek,Lotek PinPoint GPS-Argos 75,,60,,,229324,,blood taken,,32.577316,-80.144126,,20/4/2022,2022/04/20 00:00:00.00,KIAWAHWEST,1262-04565,,,FELG(2+5)/-:-/m,,u,"'{culmenInMillimeters:36.4,theadInMilimeters:65.9, wingInMillimeters:170}'",152,,,,,
302,,,track,"SC tags, grouped with Atlantic Shores, see SC for deployemnt details (F.Sanders)",1235069252,Atlantic Shores,55564,17165,Lotek,Lotek PinPoint GPS-Argos 75,,60,,,229325,,blood taken,,32.577316,-80.144126,,20/4/2022,2022/04/20 00:00:00.00,KIAWAHWEST,1262-04990,,,FEDG(PHP)/-:-/m,,u,"'{culmenInMillimeters:34.9,theadInMilimeters:65.1, wingInMillimeters:171}'",136,,,,,
303,,,track,"SC tags, grouped with Atlantic Shores, see SC for deployemnt details (F.Sanders)",1235069252,Atlantic Shores,55565,17165,Lotek,Lotek PinPoint GPS-Argos 75,,60,,,229326,,blood taken,,32.577316,-80.144126,,20/4/2022,2022/04/20 00:00:00.00,KIAWAHWEST,1332-72215,,,FELG(+X3)/-:-/m,,u,"'{culmenInMillimeters:33.0,theadInMilimeters:63.5, wingInMillimeters:174}'",136,,,,,
304,"Missing REF , marked as not deployed in spring 2022 and will be deployed in NY 2023? Points have no geometry ?",,not_deployed,,,Atlantic Shores,55566,17165,Lotek,Lotek PinPoint GPS-Argos 75,,60,,,229327,,,,,,,,,,,,,,,,,,,,,,
305,,,track,"SC tags, grouped with Atlantic Shores, see SC for deployemnt details (F.Sanders)",1235069252,Atlantic Shores,55567,17165,Lotek,Lotek PinPoint GPS-Argos 75,,60,,,229328,,blood taken,,32.577316,-80.144126,,20/4/2022,2022/04/20 00:00:00.00,KIAWAHWEST,1262-04570,,,FELG(3+8)/-:-/m,,u,"'{culmenInMillimeters:34.4,theadInMilimeters:61.1, wingInMillimeters:180}'",140,,,,,
306,,,failed,"SC tags, grouped with Atlantic Shores, see SC for deployemnt details (F.Sanders)",1235069252,Atlantic Shores,55568,17165,Lotek,Lotek PinPoint GPS-Argos 75,,60,,,229329,,blood taken,,32.577316,-80.144126,,20/4/2022,2022/04/20 00:00:00.00,KIAWAHWEST,1332-72217,,,FELG(+A4)/-:-/m,,u,"'{culmenInMillimeters:34.8,theadInMilimeters:64.4, wingInMillimeters:172}'",139,,,,,
307,,,track,"SC tags, grouped with Atlantic Shores, see SC for deployemnt details (F.Sanders)",1235069252,Atlantic Shores,55569,17165,Lotek,Lotek PinPoint GPS-Argos 75,,60,,,229330,,blood taken,,32.577316,-80.144126,,20/4/2022,2022/04/20 00:00:00.00,KIAWAHWEST,1262-04586,,,FELG(6+9)/-:-/m,,u,"'{culmenInMillimeters:33.5,theadInMilimeters:61.9, wingInMillimeters:170}'",136,,,,,
308,Missing REF ,,not_deployed/failed,,,Atlantic Shores,55570,17165,Lotek,Lotek PinPoint GPS-Argos 75,,60,,,229331,,,,,,,,,,,,,,,,,,,,,,
309,,,track,"SC tags, grouped with Atlantic Shores, see SC for deployemnt details (F.Sanders)",1235069252,Atlantic Shores,55571,17165,Lotek,Lotek PinPoint GPS-Argos 75,,60,,,229332,,blood taken,,32.577316,-80.144126,,20/4/2022,2022/04/20 00:00:00.00,KIAWAHWEST,1332-72209,,,FELG(+P3)/-:-/m,,u,"'{culmenInMillimeters:38.2,theadInMilimeters:69.5, wingInMillimeters:173}'",150,,,,,
310,"Missing REF , marked as not deployed in spring 2022 and will be deployed in NY 2023? Points have no geometry ?",,not_deployed,listed in atlantic but no record of deployment info?,,Atlantic Shores,55572,17165,Lotek,Lotek PinPoint GPS-Argos 75,,60,,,229333,,,,,,,,,,,,,,,,,,,,,,
311,"Missing REF , marked as not deployed in spring 2022 and will be deployed in NY 2023? Points have no geometry ?",,not_deployed,listed in atlantic but no record of deployment info?,,Atlantic Shores,55573,17165,Lotek,Lotek PinPoint GPS-Argos 75,,60,,,229334,,,,,,,,,,,,,,,,,,,,,,
312,,,track,"SC tags, grouped with Atlantic Shores, see SC for deployemnt details (F.Sanders)",1235069252,Atlantic Shores,55574,17165,Lotek,Lotek PinPoint GPS-Argos 75,,60,,,229335,,,,32.577316,-80.144126,,20/4/2022,2022/04/20 00:00:00.00,KIAWAHWEST,1262-04589,,,FELG(7+8)/-:-/m,,u,"'{culmenInMillimeters:33.3,theadInMilimeters:62.1, wingInMillimeters:170}'",139,,,,,
313,Missing REF ,,failed,,1235069252,Atlantic Shores,55575,17165,Lotek,Lotek PinPoint GPS-Argos 75,,60,,,229336,,deployment estimate as no reference data,,,,,,,,,,,,,,,,,,,,
314,"Missing REF , marked as not deployed in spring 2022 and will be deployed in NY 2023? Points have no geometry ?",,not_deployed,listed in atlantic but no record of deployment info? Good faith replacement,,Atlantic Shores,55576,17165,Lotek,Lotek PinPoint GPS-Argos 75,,60,,,229337,,,,,,,,,,,,,,,,,,,,,,
61,,,track,Red Knot Atlantic Shores,1235069252,Atlantic Shores,55898,7165,Lotek,Lotek PinPoint GPS-Argos 75,,,,,233781,,,,,,,18/8/2022,2022/08/18 11:13:00.00,NBRIG,1392-35158,,,FELG(5K>)/-:-/m,ASY,u,"'{culmenInMillimeters:37.1,theadInMilimeters:64, wingInMillimeters:172}'",170,10:15,58,,,
257,,,track,Red Knot Migration Study ECCC,2272951887,ECCC,43375,,Lotek,Sunbird,,,,,242582,SB/monofilament nylon,blood taken,,,,,15/8/2023,2023-08-15  13:30:00 PM,NBRIG,1332-26479,FEDG(K89),NBRIG_242582_2023,FEDG(K89)/-:-/m,ASY,u ,"{culmenInMillimeters:36.4,theadInMilimeters:66.2, wingInMillimeters:170}'",186,13:30,137,,,
258,,,track,Red Knot Migration Study ECCC,2272951887,ECCC,43376,,Lotek,Sunbird,,,,,242583,,feather and blood taken,,,,,16/5/2023,2023/05/16 11:14:00.00,MOORES,1392-24080,FELG(J*U),MOOR_242583_2023,FELG(J*U)/-:-/m,ASY,u ,"{culmenInMillimeters:35.1,theadInMilimeters:65.4, wingInMillimeters:168}'",145,11:14,57,,,
,,,not_deployed,,,ECCC,,,,,,,,,255007,,,,,,,,,,,,,,,,,,,,,,
,,,not_deployed,,,ECCC,,,,,,,,,260800,,,,,,,,,,,,,,,,,,,,,,
,,,not_deployed,,,ECCC,,,,,,,,,260801,,,,,,,,,,,,,,,,,,,,,,
,,,not_deployed,,,ECCC,,,,,,,,,260802,,,,,,,,,,,,,,,,,,,,,,
,,,not_deployed,,,ECCC,,,,,,,,,260803,,,,,,,,,,,,,,,,,,,,,,
,,,not_deployed,,,ECCC,,,,,,,,,260804,,,,,,,,,,,,,,,,,,,,,,
,,,not_deployed,,,ECCC,,,,,,,,,260805,,,,,,,,,,,,,,,,,,,,,,
,,,not_deployed,,,ECCC,,,,,,,,,260806,,,,,,,,,,,,,,,,,,,,,,
,,,not_deployed,,,ECCC,,,,,,,,,260807,,,,,,,,,,,,,,,,,,,,,,
,,,not_deployed,,,ECCC,,,,,,,,,260808,,,,,,,,,,,,,,,,,,,,,,
,,,not_deployed,,,ECCC,,,,,,,,,260809,,,,,,,,,,,,,,,,,,,,,,
,,,not_deployed,,,ECCC,,,,,,,,,260810,,,,,,,,,,,,,,,,,,,,,,
,,,not_deployed,,,ECCC,,,,,,,,,260811,,,,,,,,,,,,,,,,,,,,,,
,,,not_deployed,,,ECCC,,,,,,,,,260812,,,,,,,,,,,,,,,,,,,,,,
,,,not_deployed,,,ECCC,,,,,,,,,260813,,,,,,,,,,,,,,,,,,,,,,
,,,not_deployed,,,ECCC,,,,,,,,,260814,,,,,,,,,,,,,,,,,,,,,,
,,,not_deployed,,,ECCC,,,,,,,,,260815,,,,,,,,,,,,,,,,,,,,,,
,,,not_deployed,,,ECCC,,,,,,,,,260816,,,,,,,,,,,,,,,,,,,,,,
,,,not_deployed,,,ECCC,,,,,,,,,260817,,,,,,,,,,,,,,,,,,,,,,
,,,not_deployed,,,ECCC,,,,,,,,,260818,,,,,,,,,,,,,,,,,,,,,,
,,,not_deployed,,,ECCC,,,,,,,,,260819,,,,,,,,,,,,,,,,,,,,,,
,,,not_deployed,,,ECCC,,,,,,,,,260820,,,,,,,,,,,,,,,,,,,,,,
,,,not_deployed,,,ECCC,,,,,,,,,261434,,,,,,,,,,,,,,,,,,,,,,
,,,not_deployed,,,ECCC,,,,,,,,,261435,,,,,,,,,,,,,,,,,,,,,,
,,,not_deployed,,,ECCC,,,,,,,,,261436,,,,,,,,,,,,,,,,,,,,,,
,,,not_deployed,,,ECCC,,,,,,,,,261437,,,,,,,,,,,,,,,,,,,,,,
,,,not_deployed,,,ECCC,,,,,,,,,261438,,,,,,,,,,,,,,,,,,,,,,
,,,not_deployed,,,ECCC,,,,,,,,,261439,,,,,,,,,,,,,,,,,,,,,,
,,,not_deployed,,,ECCC,,,,,,,,,261440,,,,,,,,,,,,,,,,,,,,,,
,,,not_deployed,,,ECCC,,,,,,,,,261441,,,,,,,,,,,,,,,,,,,,,,
,,,not_deployed,,,ECCC,,,,,,,,,261442,,,,,,,,,,,,,,,,,,,,,,
,,,not_deployed,,,ECCC,,,,,,,,,261443,,,,,,,,,,,,,,,,,,,,,,
,,,not_deployed,,,ECCC,,,,,,,,,261444,,,,,,,,,,,,,,,,,,,,,,
,,,not_deployed,,,ECCC,,,,,,,,,261445,,,,,,,,,,,,,,,,,,,,,,
,,,not_deployed,,,ECCC,,,,,,,,,261446,,,,,,,,,,,,,,,,,,,,,,
,,,not_deployed,,,ECCC,,,,,,,,,261447,,,,,,,,,,,,,,,,,,,,,,
,,,not_deployed,,,ECCC,,,,,,,,,261448,,,,,,,,,,,,,,,,,,,,,,
,,,not_deployed,,,ECCC,,,,,,,,,261449,,,,,,,,,,,,,,,,,,,,,,
,,,not_deployed,,,ECCC,,,,,,,,,261450,,,,,,,,,,,,,,,,,,,,,,
,,,not_deployed,,,ECCC,,,,,,,,,261451,,,,,,,,,,,,,,,,,,,,,,
,,,not_deployed,,,ECCC,,,,,,,,,261452,,,,,,,,,,,,,,,,,,,,,,
,,,not_deployed,,,ECCC,,,,,,,,,261453,,,,,,,,,,,,,,,,,,,,,,
,,,not_deployed,,,ECCC,,,,,,,,,262940,,,,,,,,,,,,,,,,,,,,,,
,,,not_deployed,,,ECCC,,,,,,,,,262941,,,,,,,,,,,,,,,,,,,,,,
,,,not_deployed,,,ECCC,,,,,,,,,262942,,,,,,,,,,,,,,,,,,,,,,
,,,not_deployed,,,ECCC,,,,,,,,,262943,,,,,,,,,,,,,,,,,,,,,,
,,,not_deployed,,,ECCC,,,,,,,,,262944,,,,,,,,,,,,,,,,,,,,,,
,,,not_deployed,,,ECCC,,,,,,,,,262945,,,,,,,,,,,,,,,,,,,,,,
,,,not_deployed,,,ECCC,,,,,,,,,262946,,,,,,,,,,,,,,,,,,,,,,
,,,not_deployed,,,ECCC,,,,,,,,,262947,,,,,,,,,,,,,,,,,,,,,,
,,,not_deployed,,,ECCC,,,,,,,,,262948,,,,,,,,,,,,,,,,,,,,,,
,no_location_data,,failed,Red Knot rufa Migration Quebec,1391392826,Red Knot rufa Migration Quebec,6369C26,,Microwave Telemetry,2gSolarPTT,2,60,,signal failed-Bird resighted later,863,neck-loop harness,,,50.192778,-63.745278,,2020/08/22,2020/08/22 00:00:00.00,MINGAN_NIAPISKAU,802-64791,,,FEW(MAJ),HY,M," '{culmenInmillimeters:34.5, theadInMillimeters: , wingInMillimeters: 160}'",131.0,,,,,
,no_location_data,,,Red Knot rufa Migration Quebec,1391392826,Red Knot rufa Migration Quebec,6369C35,,Lotek,Loteck 5/PPT-10,4,60,,,180290,glued,,,50.192778,-63.745278,,2020/08/22,2020/08/22 00:00:00.00,MINGAN_NIAPISKAU,802-64790,,,FEW(MAK),AHY,M," '{culmenInmillimeters:32.9, theadInMillimeters: , wingInMillimeters: 167}'",130.5,,,,,
,no_location_data,,,Red Knot rufa Migration Quebec,1391392826,Red Knot rufa Migration Quebec,6369C4C,,Lotek,Loteck 5/PPT-10,4,60,,,180291,neck-loop harness,,,50.193056,-63.854722,,2020/10/02,2020/10/02 00:00:00.00,MINGAN_GRANDE,9802-82365,,,FEW(MCM),HY,F," '{culmenInmillimeters:35.4, theadInMillimeters: , wingInMillimeters: 160}'",129.4,,,,,
,no_location_data,,failed,Red Knot rufa Migration Quebec,1391392826,Red Knot rufa Migration Quebec,6369C5F,,Lotek,Loteck 5/PPT-10,4,60,,signal failed-Bird resighted later,180292,glued,,,50.192778,-63.745278,,2020/08/22,2020/08/22 00:00:00.00,MINGAN_NIAPISKAU,802-64789,,,FEW(MAL),AHY,F," '{culmenInmillimeters:34.8, theadInMillimeters: , wingInMillimeters: 166}'",133.0,,,,,
,no_location_data,,,Red Knot rufa Migration Quebec,1391392826,Red Knot rufa Migration Quebec,6369C6A,,Lotek,Loteck 5/PPT-10,4,60,,,180293,neck-loop harness,,,50.192778,-63.745278,,2020/09/01,2020/09/01 00:00:00.00,MINGAN_NIAPISKAU,9802-82320,,,FEW(MEX),HY,F," '{culmenInmillimeters:35.2, theadInMillimeters: , wingInMillimeters: 162}'",138.2,,,,,
,no_location_data,,,Red Knot rufa Migration Quebec,1391392826,Red Knot rufa Migration Quebec,6369C79,,Lotek,Loteck 5/PPT-10,4,60,,,180294,neck-loop harness,,,50.192778,-63.745278,,2020/08/22,2020/08/22 00:00:00.00,MINGAN_NIAPISKAU,802-64787,,,FEW(MAV),AHY,M," '{culmenInmillimeters:37.2, theadInMillimeters: , wingInMillimeters: 163}'",146.0,,,,,
,no_location_data,,failed,Red Knot rufa Migration Quebec,1391392826,Red Knot rufa Migration Quebec,6369C8B,,Lotek,Loteck 5/PPT-10,4,60,,Signal failed but don't know if bird alive,180295,glued,,,50.193056,-63.854722,,2020/10/02,2020/10/02 00:00:00.00,MINGAN_GRANDE,9802-82363,,,FEW(MCK),HY,M," '{culmenInmillimeters:35.1, theadInMillimeters: , wingInMillimeters: 161}'",127.5,,,,,
,no_location_data,,,Red Knot rufa Migration Quebec,1391392826,Red Knot rufa Migration Quebec,6369C98,,Lotek,Loteck 5/PPT-10,4,60,,,180296,neck-loop harness,,,50.193056,-63.854722,,2020/10/02,2020/10/02 00:00:00.00,MINGAN_GRANDE,9802-82360,,,FEW(MCE),HY,F," '{culmenInmillimeters:37.7, theadInMillimeters: , wingInMillimeters: 170}'",134.4,,,,,
,no_location_data,,failed,Red Knot rufa Migration Quebec,1391392826,Red Knot rufa Migration Quebec,6369CAD,,Lotek,Loteck 5/PPT-10,4,60,,signal failed-Bird resighted later,180297,glued,,,50.192778,-63.745278,,2020/09/01,2020/09/01 00:00:00.00,MINGAN_NIAPISKAU,9802-82321,,,FEW(MEN),HY,F," '{culmenInmillimeters:33.2, theadInMillimeters: , wingInMillimeters: 158}'",134.2,,,,,
,no_location_data,,,Red Knot rufa Migration Quebec,1391392826,Red Knot rufa Migration Quebec,6369CBE,,Lotek,Loteck 5/PPT-10,4,60,,,180298,neck-loop harness,,,50.192778,-63.745278,,2020/09/01,2020/09/01 00:00:00.00,MINGAN_NIAPISKAU,802-64799,,,FEW(MEE),HY,M," '{culmenInmillimeters:35.2, theadInMillimeters: , wingInMillimeters: 160}'",137.3,,,,,
,no_location_data,,,Red Knot rufa Migration Quebec,1391392826,Red Knot rufa Migration Quebec,6369CC7,,Lotek,Loteck 5/PPT-10,4,60,,,180299,neck-loop harness,,,50.192778,-63.745278,,2020/08/22,2020/08/22 00:00:00.00,MINGAN_NIAPISKAU,802-64786,,,FEW(MAA),AHY,M," '{culmenInmillimeters:32.8, theadInMillimeters: , wingInMillimeters: 161}'",131.0,,,,,
,no_location_data,,,Red Knot rufa Migration Quebec,1391392826,Red Knot rufa Migration Quebec,F74BD35,,Lotek,Loteck 5/PPT-10,4,60,,,180300,glued,,,50.193056,-63.854722,,2020/10/02,2020/10/02 00:00:00.00,MINGAN_GRANDE,9802-82362,,,FEW(MCJ),HY,F," '{culmenInmillimeters:36.6, theadInMillimeters: , wingInMillimeters: 166}'",132.1,,,,,
,no_location_data,,,Red Knot rufa Migration Quebec,1391392826,Red Knot rufa Migration Quebec,F74BD4C,,Lotek,Loteck 5/PPT-10,4,60,,,194899,neck-loop harness,,,50.192778,-63.745278,,2020/09/01,2020/09/01 00:00:00.00,MINGAN_NIAPISKAU,9802-82322,,,FEW(MET),HY,F," '{culmenInmillimeters:34.5, theadInMillimeters: , wingInMillimeters: 164}'",142.2,,,,,
,no_location_data,,,Red Knot rufa Migration Quebec,1391392826,Red Knot rufa Migration Quebec,F74BD5F,,Lotek,Loteck 5/PPT-10,4,60,,,194900,glued,,,50.192778,-63.745278,,2020/09/01,2020/09/01 00:00:00.00,MINGAN_NIAPISKAU,9802-82324,,,FEW(MEU),HY,M," '{culmenInmillimeters:33.8, theadInMillimeters: , wingInMillimeters: 160}'",127.0,,,,,
,no_location_data,,failed,Red Knot rufa Migration Quebec,1391392826,Red Knot rufa Migration Quebec,F74BD6A,,Lotek,Loteck 5/PPT-10,4,60,,Signal failed but don't know if bird alive,194901,neck-loop harness,,,50.193056,-63.854722,,2020/10/02,2020/10/02 00:00:00.00,MINGAN_GRANDE,9802-82359,,,FEW(MCC),HY,F," '{culmenInmillimeters:32.4, theadInMillimeters: , wingInMillimeters: 163}'",128.5,,,,,
,no_location_data,,failed,Red Knot rufa Migration Quebec,1391392826,Red Knot rufa Migration Quebec,F74BD79,,Lotek,Loteck 5/PPT-10,4,60,,signal failed-Bird resighted later,194902,glued,,,50.192778,-63.745278,,2020/08/22,2020/08/22 00:00:00.00,MINGAN_NIAPISKAU,802-64788,,,FEW(MAX),AHY,M," '{culmenInmillimeters:32.8, theadInMillimeters: , wingInMillimeters: 163}'",132.8,,,,,
,no_location_data,,,Red Knot rufa Migration Quebec,1391392826,Red Knot rufa Migration Quebec,F74BD8B,,Lotek,Loteck 5/PPT-10,4,60,,,194903,glued,,,50.193056,-63.854722,,2020/10/02,2020/10/02 00:00:00.00,MINGAN_GRANDE,9802-82364,,,FEW(MCL),HY,F," '{culmenInmillimeters:33.9, theadInMillimeters: , wingInMillimeters: 167}'",131.1,,,,,
,,,track,Red Knot rufa Migration Quebec,1391392826,Red Knot rufa Migration Quebec,F74BD98,,Lotek,Loteck 5/PPT-10,4,60,,,194904,neck-loop harness,,,50.193056,-63.854722,,2020/10/02,2020/10/02 00:00:00.00,MINGAN_GRANDE,9802-82361,,,FEW(MCH),HY,M," '{culmenInmillimeters:34.2, theadInMillimeters: , wingInMillimeters: 163}'",127.8,,,,,
,no_location_data,,,Red Knot rufa Migration Quebec,1391392826,Red Knot rufa Migration Quebec,0C130F2,,Lotek,Loteck 5/PPT-10,4,60,,,194905,neck-loop harness,,,50.192778,-63.745278,,2020/09/01,2020/09/01 00:00:00.00,MINGAN_NIAPISKAU,802-64798,,,FEW(MAY),HY,M," '{culmenInmillimeters:34.7, theadInMillimeters: , wingInMillimeters: 162}'",136.6,,,,,
,no_location_data,,,Red Knot rufa Migration Quebec,1391392826,Red Knot rufa Migration Quebec,0C16300,,Microwave Telemetry,2gSolarPTT,2,,,,,,,,,,,,,,,,,,,,,,,,,,
,no_location_data,,,Red Knot rufa Migration Quebec,1391392826,Red Knot rufa Migration Quebec,0C16313,,Microwave Telemetry,2gSolarPTT,2,,,,,,,,,,,,,,,,,,,,,,,,,,
,no_location_data,,,Red Knot rufa Migration Quebec,1391392826,Red Knot rufa Migration Quebec,0C16326,,Microwave Telemetry,2gSolarPTT,2,60,,,198865,neck-loop harness,,,50.193056,-63.854722,,2020/10/02,2020/10/02 00:00:00.00,MINGAN_GRANDE,9802-82358,,,FEW(MCA),HY,F," '{culmenInmillimeters:37.3, theadInMillimeters: , wingInMillimeters: 169}'",144.2,,,,,
,no_location_data,,,Red Knot rufa Migration Quebec,1391392826,Red Knot rufa Migration Quebec,0D4EF5F,,Microwave Telemetry,2gSolarPTT,2,,,,,,,,,,,,,,,,,,,,,,,,,,
,no_location_data,,,Red Knot rufa Migration Quebec,1391392826,Red Knot rufa Migration Quebec,0D4EF6A,,Lotek,Loteck 5/PPT-10,4,60,,,199797,glued,,,50.192778,-63.745278,,2020/09/01,2020/09/01 00:00:00.00,MINGAN_NIAPISKAU,9802-82323,,,FEW(MEH),HY,M," '{culmenInmillimeters:32.8, theadInMillimeters: , wingInMillimeters: 162}'",125.7,,,,,
,,,failed,Red Knot rufa Migration Quebec,1391392826,Red Knot rufa Migration Quebec,0D4EF79,,Lotek,Loteck 5/PPT-10,4,60,,,199798,glued,,,50.192778,-63.745278,,2020/08/22,2020/08/22 00:00:00.00,MINGAN_NIAPISKAU,802-64793,,,FEW(MAN),HY,F," '{culmenInmillimeters:33.9, theadInMillimeters: , wingInMillimeters: 164}'",132.0,,,,,
,no_location_data,,,Red Knot rufa Migration Quebec,1391392826,Red Knot rufa Migration Quebec,0D4EF8B,,Lotek,Loteck 5/PPT-10,4,60,,,199799,glued,,,50.192778,-63.745278,,2020/08/22,2020/08/22 00:00:00.00,MINGAN_NIAPISKAU,802-64794,,,FEW(MAM),HY,M," '{culmenInmillimeters:32.3, theadInMillimeters: , wingInMillimeters: 164}'",133.0,,,,,
,no_location_data,,failed,Red Knot rufa Migration Quebec,1391392826,Red Knot rufa Migration Quebec,0D4EF98,,Lotek,Loteck 5/PPT-10,4,60,,Signal failed but don't know if bird alive,199800,neck-loop harness,,,50.192778,-63.745278,,2020/08/22,2020/08/22 00:00:00.00,MINGAN_NIAPISKAU,802-64792,,,FEW(MAH),HY,F," '{culmenInmillimeters:34.4, theadInMillimeters: , wingInMillimeters: 166}'",131.2,,,,,
,no_location_data,,failed,Red Knot rufa Migration Quebec,1391392826,Red Knot rufa Migration Quebec,0D4EFAD,,Lotek,Loteck 5/PPT-10,4,60,,signal failed-Bird resighted later,199801,glued,,,50.192778,-63.745278,,2020/10/16,2020/10/16 00:00:00.00,MINGAN_NIAPISKAU,9802-82377,,,FEW(MHY),HY,M," '{culmenInmillimeters:31.8, theadInMillimeters: , wingInMillimeters: 162}'",128.5,,,,,
,no_location_data,,failed,Red Knot rufa Migration Quebec,1391392826,Red Knot rufa Migration Quebec,0D4EFBE,,Lotek,Loteck 5/PPT-10,4,60,,signal failed-Bird resighted later,199802,glued,,,50.192778,-63.745278,,2020/10/16,2020/10/16 00:00:00.00,MINGAN_NIAPISKAU,9802-82379,,,FEW(MKC),HY,M," '{culmenInmillimeters:33.2, theadInMillimeters: , wingInMillimeters: 157}'",127.2,,,,,
,no_location_data,,failed,Red Knot rufa Migration Quebec,1391392826,Red Knot rufa Migration Quebec,0D4EFC7,,Lotek,Loteck 5/PPT-10,4,60,,Signal failed but don't know if bird alive,199803,neck-loop harness,,,50.192778,-63.745278,,2020/10/16,2020/10/16 00:00:00.00,MINGAN_NIAPISKAU,9802-82374,,,FEW(MHU),HY,M," '{culmenInmillimeters:37.3, theadInMillimeters: , wingInMillimeters: 163}'",131.9,,,,,
